"id","parsedContent"
"Blog_지름신_201701_288","카오산 로드 미키 케이스 사다 위하다 포리 카오산 로드 포리 가다 만나다 퇴근 시간 도로 주차장 변신 친구 멀미 같다 하다 중간 택시 내리다 구글 보다 걷다 넘다 걷다 도로 한산하다 지다 택시 타다 도착 동생 선물 주다 큰소리 치다 놓다 사야 키우 핸드폰 동생 사진 보내다 와이파이 있다 선택 스마일 사리다 하다 보다 스마일 예쁘다 동생 그거 살다 이러다 물다 보다 선물 포장 달다 하다 기다리다 동안 셀카 즐겁다 마음 키우 핸드폰 케이스 구매 사다 위하다 카르마 스프레이 좋다 쓰다 지다 않다 수화물 이다 무게 때문 지름신 내려놓다 스프레이 구매 카르마 바이바이 카르마 식사 영수증 있다 할인 되다 하다 지금 되다 모르다 호텔 돌아오다 우리 기다리다 옥타브 가다 위하다 주다 비중 이때 슬프다 오다 모르다 즐겁다 마음 드레스 호텔 옥타브 출발 날씨 좋다 우리 예쁘다 칭찬 셀카 남기다 보다 다르다 클로징 분위기 나다 야외 자리 없다 마음 내려오다 하다 우기 방콕 우기 가다 비와 루프 가다 로비 내려오다 심하다 내리다 라운 지바 간단하다 마시다 올라가다 하다 바도 마감 룸서비스 시키다 꾸미다 아깝다 사진 찍다 로비 있다 없다 아쉽다 마음 뒤로하다 올라가다 룸서비스 시키다 여행 마지막 정리 하다 체크아웃 호텔 맡기다 두다 택시 기다리다 마지막 일정 티어 쇼핑 사지 완전 귀엽다 핸드폰 케이스 크기 크다 패스 예쁘다 스텔라 맥카트니 크리퍼 지다 블링 블링 그러다 편집 오다 스타일 마르다 쓰다 있다 페레 가모 그지 마르다 보다 지름신 분출 하다 한화 계산 세일 얼마 비싸다 싶다 고민 고민 물건 사다 마지노선 정하다 놓다 보다 예쁘다 발렌시아 클러치 여름 들다 상큼하다 같다 마르다 말다 이것 사다 오다 하다 들다 보다 들다 사다 없다 마르니 레드 그린 고민 고급 그린 먹다 나오다 거리 마르다 가방 세트 같다 검색 보다 정가 얼마 이거 사야 점심 있다 어나더 하운드 한국 인기인 보태다 커다 인테리어 다행 메뉴판 사진 있다 고민 쉽다 고르다 있다 메뉴판 사진 까먹다 맛있다 보이다 주문 기다리다 식전 기다리다 메뉴 빠르다 흡입 방콕 음식 입맛 가다 맛있다 먹물 파스타 먹다 마르다 사다 결심 가방 세트 사다 달려가다 팔리다 쇼핑 영혼 충만 스트레스 쇼핑 푸다 사고 기분 건물 이동 사이즈 모형 보이다 사진 찍다 강아지 작년 없다 내리다 찍다 하다 남다 사진 후식 방콕 로스트 백화점 있다 같다 하다 가다 하다 기억 남다 외석 있다 앉다 싶다 인석 아쉽다 포기 실내 앉다 와플 커피 주문 오다 쥬얼 깡패 깡패 완전 맛있다 커피 맛있다 하다 좋다 놀다 보다 시간 지나다 우리 호텔 돌아가다 찾다 로드 출발 시간 넉넉하다 로드 스타 벅스 가다 하다 시간 사지 예약 시간 아쉽다 어쩌다 스파 가다 하다 스파 매장 찾다 주변 돌다 도착 여정 주소 왠만하다 태국어 되다 있다 주소 택시 기사 보이다 주다 분위기 좋다 스파 자리 앉다 주다 웰컴 판매 스파 상품 우리 공홈 회원 가입 바디 테라 피로 예약 선택지 체크 고르다 오일 선택 맛사 지실 없다 나누다 들어가다 가격 정도 시설 시설 세부 제이 파크 아일랜드 사지 프로그램 비슷하다 시설 좋다 완전 강추 스파 완전 천국 사지 끝내다 따뜻하다 한잔 좋다 뒤로하다 공항 가다 하다 시간 스파 부탁 택시 픽업 하다 택시 맞다 좋다 다음 오다 약속 방콕 공항 도착 체크인 수화물 정도 신발 빼다 맞추다 타다 하다 나스 돌체 비타 사다 하다 바르다 아프다 보이다 건강 좋다 보이다 컬러 정도 사다 오다 한국 돌체 비타 사다 금액 아프다 보이다 사다 오다 하다 한국 어디 두다 모르다 쇼핑 브레이커 생각 따르다 들어가다 윌리 갖다 싶다 클릭 알다 오렌지 공포 제주 항공 좌석 간격 시간 동안 괴롭다 정도 크다 사람 괴롭다 신나다 행복 방콕 여행 하루하루 즐겁다 시간 가다 아깝다 가다 약속 우리 여행 나다"
"Blog_지름신_201701_2886","짜다 지름신 오다 무경 자기 사다 그릇 사다 그릇 이쁘다 밥상 차리다 주다 산천어 잡다 가다 채우다 아침 메뉴 한우 떡갈비 계란 만둣국 갓김치 창난젓 멸치 볶음 고추 마늘 아찌 한상 차리다 이쁘다 무경 자기 세트 맞추다 밥상 차리다 뜨끈하다 사골 국물 만두 넣다 계란 풀다 계란 만둣국 각종 밑반찬 한우 떡갈비 사각 밥그릇 국그릇 찬그릇 블랙 색상 마음 들다 블랙 그렇다 반찬 보이다 하다 그러다 만족 깔끔하다 넘다 좋다 잡다 넣다 흑미 넣다 강황 넣다 강황 잡곡밥 끄다 비비다 넣다 비싸다 계란 풀다 국물 먹다 신랑 밥그릇 작다 좋다 하다 인분 같다 고봉밥 쌓다 주다 맛있다 들다 넣다 넣다 먹다 싶다 눈치 밑반찬 총사 신랑 먹다 싶다 한우 떡갈비 야무지다 굽다 주다 근처 한우 가게 한우 세일 장보다 한우 떡갈비 국내 한우 국내 재료 만들다 가격 저렴하다 집다 오다 냉동 떡갈비 넘다 맛있다 신랑 맛있다 굽다 주다 새싹 올리다 샐러드 먹다 밑반찬 갓김치 창난젓 멸치 볶음 고추 마늘 아찌 요새 홀릭 되다 갓김치 맛있다 신랑 먹다 싶다 사본 창난젓 신랑 그렇다 먹다 맛있다 보다 먹다 얼다 먹다 마늘 넣다 아몬드 넣다 멸치 볶다 친구 오다 밑반찬 없다 멸치 볶음 콩자반 생산 계란 만둣국 넣다 계란 풀다 맛있다 그릇 사준 신랑 고맙다 맛있다 그릇 맛있다 하다 주다 훈련 내다 오다"
"Blog_지름신_201701_2890","일본 일본 오사카 여행기 타다 위치 유니버설 스튜디오 재팬 복사 본문 기타 기능 지도 보다 번역 보다 조카 기다리다 기다리다 스튜디오 새벽 일어나다 준비 아이 걸어가다 발걸음 뛰다 가다 아침 어디 먹다 하다 우동 소바 뎀뿌라 우동 맛있다 우리 이쁘다 수지 내리다 들어가다 분위기 외국 같다 요기 외국 도쿄 오다 이모 올케 조카 오디 사라지다 디다 입구 보이다 주년 역쉬 이곳 찍다 하다 작다 누구 들다 있다 미니언 무섭다 가다 못하다 수지 떨어지다 서다 사진 찍다 입구 지름신 오다 생기다 쓰다 보다 셀카 수지 미니언 머리띠 구입 기여 아웅 기여 요기 저기 거리 미국 같다 마릴린 몬로 보이다 핑크 판다 보이다 빼다 대기 시간 길다 해리 포터 달려가다 들어가다 입구 기운 사진 찍다 서다 있다 통과 입구 보이다 오다 마야 사람 많다 보다 완전 해리 포터 마을 같다 멋지다 만들다 놓다 들어가다 입구 음악 멋지다 담다 보다 오디 가다 해리 포터 보이다 멋지다 대단하다 공연 하다 마법 지팡이 팔다 있다 모양 멋지다 만들다 알다 해리 포터 마을 이곳저곳 지도 따라다니다 마법 부리다 경험 하다 있다 막대기 대기 시간 무섭다 소문 심약 기다리다 하다 명만 입장 기웃거리다 다님 아웅 소리 물다 유명 버터 맥주 알콜 보다 탄산 음료 생크림 올려놓다 같다 먹다 넘기다 생크림 맛있다 한잔 마시다 버리다 해리 포터 나오다 원더랜드 고다 기여 울다 많다 열차 있다 조카 타다 난리 키티 호빵 머리띠 부분 까만색 보이다 머리 얹다 놓다 듯하다 느낌 넘기다 요기 키티 물건 없다 전체 쇼핑몰 있다 문관 있다 하다 시반 퍼레이드 시작 하다 자리 좋다 대기 여기 퍼레이드 사람 하다 축제 즐기다 만들다 주다 청소 생각 제끼다 뿌리다 던지다 엄청나다 축제 현장 있다 같다 기분 들다 재다 있다 오다 가다 거품 폭탄 투하 엄청나다 들다 등장 길이 길다 어른 같다 입구 보다 미니언 즐겁다 대기 시간 길다 무섭다 많다 마니 타지 하다 타다 있다 타다 즐겁다 시간 보내다 오다 일본 걸리다 같다 오사카 니버 스튜디오 재팬 해리 포터 원더랜드"
"Blog_지름신_201701_2898","부산 경남 맛집 부산 서면 카페 예원 조용 힐링 카페 복사 본문 기타 기능 지도 보다 번역 보다 하다 소개 드리다 카페 예원 부산광역시 부산진구 새싹 예원 전화 상세 보다 지도 보다 여기 다녀오다 완전 들다 소개 싶다 모르다 생각 방문 스타일 보다 이쪽 가다 모르다 보다 원래 판매 운영 확장 이사 카페 오픈 넘다 드다 보다 세상 숨다 있다 모르다 마시다 전통 카페 생각 대박 대박 다도 하다 마시다 좋다 하다 굉장하다 선물 되다 같다 공간 볼거리 많다 마시다 많다 하다 아다 이것저것 물다 보다 많다 여기 가다 보다 다도 즐기다 있다 소개 싶다 뽐뿌 지름신 겁나다 오다 참다 내다 엄마 모시다 방문 예정 요거 넘다 고급 지다 반대편 모습 평범하다 카페 같다 혼자 오다 부담 창가 자리 운치 있다 좋다 거기 가다 그녀 반하다 버리다 이것 군것질 하다 파다 저희 타르트 셀렉 메뉴 보다 메뉴판 주다 플라워 허브티 종류 중국차 종류 꽃차 메뉴 보다 메리 골드 있다 알다 메리 골드 해당화 매화 목련 아마란스 생강나무 상세하다 꽃말 효능 기재 있다 어렵다 않다 고르다 있다 중국차 메뉴 친절 중국 대하다 설명 적히다 있다 모르다 읽다 보다 좋다 유용 정보 중국차 메뉴 보다 그녀 선택 정산소종 홍차 아이 강하다 훈연 특징 기름지다 자극 음식 어울리다 하다 우유 설탕 첨가 않다 홍차 본연 느끼다 즐기다 좋다 차다 세상 생강 보이차 오미자 스파클 독특 많다 다도 선생 나누다 주다 마시다 보다 대홍포 선택 대홍포 중국 복건성 무이산 생성 무이암차 품종 최고 손꼽히다 불리우다 찻잎 색깔 녹갈색 선명 윤기 있다 황금색 깊다 특징 대홍포 입맛 맞다 탐내다 찻잔 걸이 귀엽다 테이블 포트 되다 있다 저희 테이블 왕따 나오다 홍차 홍차 친절 직원 언니 내받다 가다 찻잔 다양 있다 본인 마시다 싶다 찻잔 고르다 되다 찻잔 고르다 착석 처음 우리 우리 시간 따르다 간단하다 방법 설명 주다 우리다 주다 좋다 따뜻하다 한잔 마시다 수다 수다 평온 지다 힐링 느낌 거기 추가 우리 입맛 잡다 아이 타르트 넘다 맛있다 입안 거기 무엇 내오다 여쭈다 보다 요거 중국차 주문 나오다 사이드 와플 모양 굽다 거기 고소 대추 오다 싶다 지경 좋다 되다 놓이다 지다 말리다 편지 이거 넘치다 센스 좋다 개인 좋아하다 나태주 시인 시집 발췌 반하다 버리다 소개팅 데이트 장소 손색없다 남자 데리다 가다 사랑 빠지다 유부 이상 사랑 남편 차분 느낌 들다 설명 나다 엄마 모시다 다녀오다 싶다 가다 싶다 가요 우리 강추 카페 예원 예원"
"Blog_지름신_201701_2906","만들다 먹다 일상 이야기 주말 동안 고이 솜씨 발휘 복사 본문 기타 기능 번역 보다 주말 패킹 여행 어디 나가다 않다 방콕 주말 있다 약속 일방 취소 거기 쪼다 질러대다 지름신 덕분 긴축 정책 들어가다 디다 나서다 차례 외식 줄이다 가정 경제 많다 도움 되다 고이 솜씨 발휘 차례 지나다 주말 먹다 마파두부 두부 좋다 하다 점심 사먹다 정도 마파두부 시키다 먹다 먹다 넘다 먹다 싶다 만들다 하다 싶다 마파두부 양념 만들다 생각 와구 와구 들다 주다 그르다 덕분 패스 마파두부 양념 사다 전분 사다 만들다 보다 카레 덮밥 세상 먹다 보다 카레 맛있다 그르다 쪼다 고이 주력 메뉴 동네 조림 감자 팔다 그거 사다 오다 손질 시간 걸리다 돼지고기 스팸 넣다 좋다 하다 그르다 취향 맞추다 만들다 인분 먹다 좋다 함박 스테이크 덮밥 떡갈비 함박 스테이크 우기다 이름 붙이다 우리 열일 언제 오므라이스 소스 언제 스테이크 소스 언제 위치 오다 우리 입맛 즐겁다 하다 주다 동네 재래 시장 젊다 총각 떡갈비 도톰 하다 파다 입맛 하다 맛나다 같다 틀다 야매 소스 이용 함박 스테이크 덮밥 그르다 좋다 하다 주력 메뉴 되다 쪼다 냉동고 얼리다 지다 떡갈비 남다 있다 규동 싶다 소불고기 덮밥 양념 되다 있다 소불고기 구입 만들다 양념 재료 사다 먹다 정도 사다 쉽다 편하다 합리 자기 합리 소불고기 국물 많다 덮밥 말아먹다 느낌 최대한 국물 조리다 쪼다 서다 넣다 조리다 계란 라이 하다 국물 쪼다 먹다 하다 그러다 만들다 시간 적다 가다 규동 같다 느낌 완전 만족 마트 규동 소스 팔다 고놈 쓰다 보다 세상 먹다 그렇다 건강 지다 기분 들다 사먹다 맛나다 좋다 하다 그르다 고이 나서다 많다 지다 외식 비다 먹다 마트 장본 비다"
"Blog_지름신_201701_2916","여행 후쿠오카 유후인 코스 프롤로그 복사 본문 기타 기능 번역 보다 후쿠오카 유후인 코스 프롤로그 여행 일본 온천 여행 테마 부모 모시다 후쿠오카 거치다 유후인 박다 코스 다녀오다 일본 도쿄 출장 제외 여행 일본어 하다 하다 자유 여행 부담 부모 모시다 가다 버스 타다 기차 타다 이동 수단 힘들다 불편 같다 하다 자유 하다 편하다 가다 생각 여행사 통하다 패키지 가다 동안 해외여행 다니다 자유 여행 다니다 준비 많다 일본 후쿠오카 여행 패키지 예약 놓다 준비 없다 편하다 하다 인천 공항 가깝다 대한항공 타다 시간 분만 도착 기내식 나오다 샌드위치 먹다 나다 착륙 가깝다 좋다 저희 후쿠오카 코스 방문 캐널 시티 후쿠오카 최대 쇼핑몰 가다 보다 싶다 신나다 구경 쇼핑 하다 우리 주다 흥분 쇼핑 하다 디즈니 예쁘다 귀엽다 많다 비싸다 후쿠오카 캐널 시티 가다 들리다 싶다 프랑 프랑 여기 흥분 폭풍 쇼핑 싶다 많다 코스 첫날 지름신 강림 후쿠오카 유후인 코스 식사 스다 일본 먹다 그렇다 맛있다 같다 가격 저렴하다 접시 혼자 먹다 놀래다 마시다 후쿠오카 힐튼 오크 호텔 우리 첫날 호텔 스테이 럭셔리하다 힐튼 오크 호텔 특급 호텔 객실 시설 만족도 최고 바라보다 오션 잊히다 지다 않다 후쿠오카 유후인 패키지 코스 특급 호텔 숙박 있다 선택 이유 후쿠오카 힐튼 호텔 조식 먹다 들리다 모모치 해변 인공 해변 아름답다 어디 사진 찍다 되다 만큼 좋다 우리 주다 겨울 바다 담그다 싶다 보다 엄마 혼나다 후쿠오카 유후인 코스 포함 되다 아사이 맥주 공장 견학 아시아 맥주 생산 공정 보다 하다 아사이 맥주 종류 시음 하다 보다 낮술 하다 기분 분위기 최고 낮술 먹다 우동 후쿠오카 인기 있다 우동 맛집 볶다 야채 우동 넣다 끓이다 국물 시원하다 굵다 면발 규슈 작다 교토 불리다 히타 마메 다마치 일본 전통 모습 간직 있다 일본 느끼다 있다 다양 거리 상점 구경 양조장 들리다 사하다 사다 길거리 일본 붕어빵 시식 보다 우리 나라 붕어빵 가격 대비 최고 후쿠오카 우인 코스 고노 온천 마을 료칸 유카타 입다 맛보다 이세키 요리 기대 하다 기대 무엇 적다 우리 식구 적다 무한 리필 좋다 스다 온천 지역 있다 고마츠 지옥 곳곳 솟아나다 있다 온천 보다 있다 보다 자연 경이 느끼다 지다 유황 특유 냄새 사진 느끼다 지다 후쿠오카 유후인 코스 도착 유후인 유후인 거리 아기 자기 예쁘다 맛있다 먹거리 유명 금상 고로케 벌꿀 아이스크림 줄서다 사먹다 하다 만큼 인기 대단하다 맛보다 후기 기대 만큼 유후인 이동 버스 바라보다 아름답다 하다 어색하다 온천 지역 나무 자라다 어렵다 보다 그러다 일본 보다 있다 색다르다 볼거리 같다 후쿠오카 유후인 코스 고추장 삼겹살 먹다 주다 여행 보다 먹거리 선택 없다 아쉽다 그러다 중간 고추장 삼겹살 개인 화로 굽다 일본 먹다 보다 하다 가이드 적극 추천 주다 맛보다 요구르트 특별 요플레 후쿠오카 유후인 코스 유후인 거치다 다녀오다 유명 가마 지옥 연못 온도 따르다 하다 있다 신기 신기 하늘색 온도 높다 붉은색 온도 낮다 족욕 하다 온천 달걀 옥수수 사이다 간식 해결 옥수수 같다 비싸다 가격 비하다 우리 강원도 옥수수 최고 후쿠오카 유후인 코스 마지막 숙소 로얄 호텔 마지막 특급 호텔 로얄 호텔 미인 온천 만족 지내다 미인 온천 미인 피부 좋다 지다 오션 물론 객실 헬로키티 업그레이드 되다 마지막 행복 보내다 쇼핑 이다 마지막 공항 후쿠오카 쇼핑 리스트 검색 하다 보다 가이드 추천 주다 화장품 비롯하다 의약품 먹거리 싹쓸이 하다 오다 후쿠오카 유후인 코스 패키지 여행 보다 자유 여행 바쁘다 다니다 같다 덕분 박다 동안 많다 구경 먹다 알차다 보내다 같다 하다 여행지 먹거리 대하다 선택 없다 아쉽다 있다 부모 여행 패키지 여행 옳다 선택 같다 무엇 온천 여행 만족 모습 가다 효도 하다 여행 돌아가다 비행기 타다 싶다 않다 만큼 즐거움 가족 여행 같다 이제 여행 보따리 풀다 보다"
"Blog_지름신_201701_2932","스페인 스페인 자유 여행 마드리드 쇼핑 광장 맛집 위치 복사 본문 기타 기능 지도 보다 번역 보다 마드리드 중심부 있다 광장 숙소 걷다 분도 되다 거리 바보 지하철 타다 다니다 내리다 광장 도착 뜨겁다 태양 이국 건물 우리 스페인 오다 느끼다 하다 주다 카를로스 동상 동상 궁둥이 사진 찍다 기분 따먹다 동상 지다 똥침 놓다 어떻다 하다 신기하다 한참 쳐다보다 고프다 들어가다 하몽 네이밍 보다 느끼다 지다 아우라 어마 무시 종류 있다 같다 맞다 현지 즐기다 찾다 하몽 매달리다 있다 우리 나라 정육점 연상 하다 찾다 되다 냅킨 찍다 놓다 이곳 풍기다 하몽 비릿하다 먹다 못하다 나오다 사실 감자튀김 달걀 라이 비릿하다 냄새 나다 같다 결국 하다 탄산 들이붓다 나오다 부드럽다 식감 좋아하다 하몽 입맛 맞다 저희 부부 하다 않다 그러다 안주 고기 좌우 하몽 저렴하다 가격대 높다 맛있다 하다 광장 근처 캠퍼 매장 스페인 하다 지다 좋다 편하다 유명 가죽 좋다 유명 스페인 신발 가죽 재킷 사다 실천 위하다 들어가다 핑계 좋다 매장 보유 있다 모델 다르다 할인 품목 다르다 가보세요 광장 지점 직원 친절 신랑 사다 나오다 텍스 리펀 서류 챙기다 잊다 말다 여권 갖다 다니다 부담 사진 찍다 놓다 보이다 주다 어디 지름신 오다 모르다 준비 자세 우리나라 입점 되다 스페인 거트 아이스크림 브랜드 토핑 취향 고르다 있다 괜찮다 아이스크림 먹다 먹다 질리다 않다 쇼핑 보충 하다 저희 톨레도 떠나다 보다 하다 쇼핑 즐겁다 톨레도 가다 즐겁다 댓글 공감 응원 주다 애정 이웃 환영"
"Blog_지름신_201701_2936","안녕 막내 성민 오늘 소개 드리다 이야기 여자 친구 제주도 이야기 강아지 몽이 비행기 타다 이태원 가다 기내 가방 구입 예쁘다 미용 하다 사고 다음 기대 타다 비행기 긴장 풀다 주다 위하다 맛나다 간식 주다 시간 비행 하다 첫날 도착 날씨 이쁘다 않다 바다 가다 하다 계획 취소 오설록 향하다 지름신 강림 그러다 나다 시간 얼마 지나다 않다 저녁 되다 맛나다 고등어 먹다 먹다 나다 들어가다 찍다 없다 대하다 내용 찍다 하다 잊다 짱짱하다 지다 날씨 신나다 우도 놀다 갓다 해변가 바람 좋다 푸르다 초원 가게 주변 앉다 잇다 의자 색감 있다 이쁘다 움직이다 뛰놀다 하다 고프다 이거 잊다 없다 아쉽다 포장 되다 다음 제주도 오다 여기 필수 저녁 스타 피자 먹다 많다 점심 먹다 있다 남기다 포장 가져가다 시장 뒷좌석 저희 코코 있다 피자 있다 소리 맛있다 저희 가다 그러다 마지막 밝다 오다 하늘 재밌다 행복 하루 묵다 하다 비행기 구하다 못하다 하다 가다 하다 오다 닭발 주먹밥 시키다 먹다 먹다 하다 가다 여행 힐링 되다 즐겁다 지치다 일상 힐링 위하다 편하다 스케줄 많다 먹거리 통하다 편안 쉬다 오다 바쁘다 일상 살다 계시다 여러분 자기 자신 위하다 마음 힐링 여행 추천 드리다 해외 국내 이쁘다 색다르다 먹거리 작다 사진 통하다 여러분 힐링 바라다"
"Blog_지름신_201701_294","작년 오사카 여행 이번 후쿠오카 여행 사다 오다 하다 일본 간식 말다 오사카 여행 많다 사람 사가네 하다 사다 작다 사다 오다 폭풍 후회 이번 들다 일본 병아리 사다 오다 말다 귀엽다 그림 그리다 지다 포장지 뒷면 일본 병아리 기한 쓰다 지다 있다 같다 쓰다 지다 있다 들다 있다 같다 들다 있다 일본어 마비 종이 포장지 뜯다 일본 병아리 만큼 귀엽다 그림 그림 종이 포장지 그리다 되다 한국 입국 면세점 가다 도쿄 바나나 사다 가다 하다 일본 닫다 일본 문화 모르다 후쿠오카 공항 비행기 티켓 하다 우리 없다 공항 닫다 면세점 포스 끄다 두다 일본 가족 연인 휴식 취하다 보다 덕분 당황 빠지다 말다 빠지다 없다 도쿄 바나나 도쿄 바나나 사다 오다 아쉬움 하다 말다 가지다 사이즈 팔다 크다 넘다 구매 후쿠오카 하카 타역 있다 가게 구매 가지다 판매 하다 있다 택스 프리 되다 여기 구매 택스 프리 받다 박스 사다 하다 요거 말다 돈키호테 폭풍 지름신 하다 오다 지라 없다 들다 없다 슬프다 현실 캐리어 넣다 요운 병아리 다치다 않다 하다 걱정 탑승 다음 일본 여행 캐리어 크다 넘다 가지다 가다 보다 사다 많다 캐리어 작다 설명서 요러하다 귀요미 귀엽다 맛있다 함정 퍽퍽하다 목메다 좋다 하다 녀석 넘다 부드럽다 하다 이거 넣다 맥히다 저승 사자 만나다 있다 베다 물다 들다 손바닥 묵직하다 올라오다 일본 병아리 있다 모르다 딸기 말다 있다 사이즈 등등 종류 다양 사이즈 말다 딸기 넘다 먹다 보다 싶다 다음 일본 도착 사다 먹다 보다 바닥 쓰다 지다 있다 일본어 배우다 하다 같다 히라가나 섞이다 있다 읽다 일본어 까맣다 않다 사진 어둡다 나오다 밝다 그러다 사진 노랗다 않다 그러다 넘다 맛있다 되다 나용 보다 붙이다 구멍 뚫다 주둥 뭉게다 지다 생기다 지다 나름 귀요미 말다 들다 있다 부드럽다 꿀맛 만다 껍질 얇다 들다 있다 일본 병아리 없다 일본 병아리 만다 먹다 나다 박스 하다 생각 들다 좋다 하다 박스 후회 않다"
"Blog_지름신_201701_2948","여행 오사카 자유 여행 오사카 오렌지 스트릿 쇼핑 로컬 맛집 찾아보다 복사 본문 기타 기능 번역 보다 오사카 자유 여행 다녀오다 다녀오다 다녀오다 오사카 자유 여행 일차 다녀오다 오사카 오렌지 스트릿 오사카 신사이바시 쇼핑 거리 걸어가다 나오다 오사카 오렌지 스트릿 아쉽다 가게 들다 가다 쓸다 오다 맘먹다 오다 가게 오사카 오렌지 스트릿 지름신 가다 오사카 자유 여행 오사카 오렌지 스트릿 쇼핑 천국 이쁘다 건물 이쁘다 파다 좋다 구경 다니다 사진 찍다 놀다 가다 사진 찍다 오다 돌아가다 아이템 넘다 많다 우리 만들다 주다 이쁘다 찍다 놓다 목걸이 오사카 자유 여행 오사카 오렌지 스트릿 구경 매장 있다 좋다 아이 쇼핑 하다 배고프다 맛집 찾다 다님 가다 로컬 먹다 좋다 하다 찾아보다 하다 오사카 자유 여행 오사카 오렌지 스트릿 요기 저기 돌아다니다 발견 오사카 오렌지 스트릿 로컬 맛집 여기 타다 파다 한국인 없다 로컬 맛집 일본인 많다 오사카 오렌지 스트릿 로컬 맛집 이거 사다 작다 오뎅 시키다 사다 콜라 시키다 넘다 귀엽다 오사카 자유 여행 오사카 오렌지 스트릿 로컬 맛집 이거 오뎅 감자 무우 곤약 오사카 오렌지 스트릿 맛집 오사카 오렌지 스트릿 로컬 맛집 치보 먹다 다르다 여기 맛있다 일본 먹다 하다 틀리다 틀리다 원조 맛있다 오사카 넘다 가다 같다 일본 음식 맛있다 먹다 오다 짜다 하다 맛있다 일본 살다 싶다 가다 오사카 자유 여행 넘다 좋다"
