"id","parsedContent"
"Blog_지름신_201701_1912","여행 여행기 위치 싱가포르 복사 본문 기타 기능 지도 보다 번역 보다 말레이시아 오다 싱가포르 뽑다 심산 페낭 싱가포르 시간 버스 타다 가다 자기 힘들다 자다 버스 타다 입국 심사 통과 보다 처음 생소하다 색다르다 체험 레샤 주동 지내다 쓰다 맞먹다 쓰다 동안 후회 없다 익스프레스 티켓 끊다 버리다 놀이동산 투척 여기 찍다 주다 멋지다 야경 되다 앨범 차다 넘치다 찍다 오다 흥분 클락 클락 경찰서 다음 리틀 인디아 아름답다 알다 사람 홍콩 같다 느낌 차다 지름신 강림 전날 클락 즐기다 오다 맥주 한잔 하다 비싸다 자태 보소 야경 최고 클락 아름답다 잊다 못하다 불빛 보다 하다 레샤 인연 소중 푼수"
"Blog_지름신_201701_1914","맛집 탐방 카페 리버 남양주 전망 좋다 카페 추천 복사 본문 기타 기능 번역 보다 분당 친하다 언니 지나다 울다 오다 보다 좋다 스타 필드 쇼핑 오다 있다 전화 오다 축구장 크기 스타 필드 쇼핑 지치다 있다 언니 스타 필드 접선 전망 좋다 카페 커피 마시다 싶다 하다 팔당대교 건너다 전망 좋다 남양주 카페 카페 리버 도착 성주 남편 혼자 팔당대교 건너 운전 보다 처음 긴장 다리 건너다 스타 필드 가깝다 거리 평일 보다 없다 주차 주말 한강 주차 가능 한강 마주보다 앉다 마시다 있다 전망 좋다 리버 크다 통창 비치다 한강 오다 소리 나오다 남양주 손꼽히다 전망 좋다 카페 싶다 통창 전망 보다 있다 하다 지다 석양 바라보다 있다 아메리카노 주문 스타 필드 쇼핑 딸리다 언니 위하다 치즈케이크 하다 모찌 주문 완료 로스팅 신선 원두 커피 내리다 주다 커피 기대 이번 춥다 보다 앉다 보다 좋다 날씨 좋다 갈대숲 신후 산책 좋다 어제 춥다 오늘 오다 날씨 다행 커피 기다리다 동안 언니 둘러보다 나오다 보다 서다 리버 건물 모양 맑다 하늘 한강 펼쳐지다 가슴 뚫리다 기분 좋다 좋다 연인 여기 얼굴 내밀다 사진 찍다 데이트 코스 최고 선리 벌다 좋다 모르다 신나다 사진 찍다 있다 주문 커피 치즈케이크 크림 모찌 나오다 케이크 꽂다 두다 이쁘다 치즈케이크 맛있다 먹다 주다 독특 크림 모찌 맛있다 나누다 먹다 언니 맛있다 먹다 로스팅 원두 내리다 주다 커피 마시다 보다 팔당 카페 리버 커피 빠지다 않다 드다 창가 놓이다 마도 이쁘다 소품 어쩌다 어울리다 갖다 놓다 오리 소품 은근 귀요미 파랑 한강 보이다 창가 놓이다 근사하다 느끼다 지다 카페 분위기 좋다 사장 평일 사람 없다 구경 하다 양해 구하다 언니 올라가다 보다 칵테일 있다 이쁘다 기린 소품 구경 근사하다 연발 분당 언니 리액션 좋다 가다 성주 기분 좋다 팔당 카페 선리 벌다 소품 이쁘다 내려오다 보다 가죽 공방 이거 공방 있다 구경 좋다 세상 가죽 가죽 지갑 다양 제품 있다 각종 소품 목공예 하다 하다 솜씨 보통 우리 여자 핸드 메이드 이거 공방 관심 가다 핸드 메이드 실버 만드다 제품 세상 하다 고급 작품 많다 성주 이쁘다 이어링 사다 싶다 보다 사다 고르다 쉽다 않다 가지다 싶다 스타일 있다 오다 주다 하다 득템 좋다 실버 골드 제품 부담 비싸다 천주교 불교 기독교 각종 종교 관련 얼리 있다 묵주 반지 묵주 팔찌 사다 싶다 성주군 차다 다니다 싶다 다음 오다 어울리다 십자가 목걸이 사다 주다 싶다 분당 언니 신나다 고르다 반지 독특 디자인 많다 성주 고르다 이어링 요거 가다 언니 똑같다 고르다 귀걸이 길이 줄이다 주문 반지 사이즈 없다 주문 택배 받다 하다 손가락 가늘다 맞다 사이즈 없다 반지 맞다 사이즈 주문 울리다 반지 고르다 핸드 메이드 제품 백화점 실버 제품 부담 없다 가격 우리 커피 마시다 오다 지름신 강림 실버 악세사리 마음 드다 제품 사다 언니 기분 좋다 하다 다행 이거 공방 사장 명함 챙기다 실버 제품 이것저것 고르다 보다 지다 무렵 내다보다 석양 드다 모습 보이다 하다 지다 모습 자리 앉다 보다 있다 멋지다 하다 지다 보다 가다 비밀 들어가다 나다 한강 건너편 유니온 타워 스타 필드 보이다 퇴근 시간 언니 가다 막히다 같다 나오다 보다 이쁘다 하트 조명 키다 지다 남양주 카페 리버 야경 지다 남양주 서울 근교 카페 꼽히다 전망 추천 싶다 카페 오픈 되다 보다 성주 네비 검색 되다 주소 검색 하다 찾아오다 경기도 남양주시 와부읍 팔당리 선리"
"Blog_지름신_201701_1923","안녕 춥다 겨울 보양 위하다 무엇 먹다 오리고기 즐기다 먹다 않다 생각 있다 친구 데리다 여기 오리구이 오다 맛있다 마천동 광주 오리 돌구 이전 좌석 돌판 시스템 좋다 돌판 아랫목 솥뚜껑 솥뚜껑 뜨겁다 데이다 않다 조심 되다 개운하다 매콤하다 따다 아다 갓김치 아다 행복 배기다 고기 굽다 냄새 우짜다 먹다 많다 이상 가다 반주 하다 좋다 가을 혼자 산책 찍다 두다 사진 올리다 가을 지나가다 겨울 지나가다 있다 기둘리다 참말 그러다 좋다 엄마 잠실 아그라 오다 가을 같다 잠실 에비뉴 먹다 맛나다 울엄마 세련 이국 타국 음식 들다 한국 음식 맛있다 여기 크레이프 케익 생각 나다 가다 되다 카페 루체 석촌 호수 쌓이다 앉다 있다 아메리카노 금상첨화 가을 끝자락 지름신 화장품 지름신 강림 화장품 가격 거품 많다 저렴하다 기분 전환 하다 화장품 지름 하다 없다 먹다 붉다 계열 보다 이쁘다 바르다 나다 하다 가다 생각 연하다 컬러 데일리 제격 같다 먹다 기분 전환 따다"
"Blog_지름신_201701_193","잠실역 사거리 출구 필라테스 환상 스카이 트이다 공간 원장 직강 운동 하다 필라테스 잠실 필라테스 필라테스 운동 바라보다 오후 롯데 월드 저녁 바라보다 롯데 월드 반사광 멋지다 모습 담기다 못하다 아쉬움 있다 창가 캐딜락 앉다 롯데 월드 몰다 이곳 가다 지름신 저녁 퇴근길 필라테스 잠실 필라테스 내려다보다 실역 출구 방향 롯데월드 보이다 사람 놀이동산 즐겁다 시간 갖다 있다 자이로 드롭 이거 주다 타나다 싶다 쇼핑 천국 설레이다 참다 보다 필라테스 들어오다 주차장 입구 고급 대리석 정문 고객 대형 차량 포함 무료 주차 제공 필라테스 잠실 필라테스"
"Blog_지름신_201701_194","떠나다 주말 포천 여행 여행 하다 가깝다 포천 우리 좋다 하다 육회 비빔밥 있다 묻다 따지다 않다 점심 육회 비빔밥 먹다 메뉴 다양 육회 비빔밥 시키다 설렁탕 국물 뚝배기 나오다 육회 비빔밥 허브 아일랜드 사실 포천 여행지 잡다 이유 자동차 극장 때문 영화 시간 우리 가다 싶다 허브 아일랜드 일정 맞다 않다 영화 다음 기약 불빛 동화 축제 보다 이르다 시간 허브 아일랜드 도착 허브 아일랜드 불빛 동화 축제 서울 허브 아일랜드 경기 주야간 셔틀버스 운행 안양 분당 성남 신규 운행 이용 시간 시이 요금 일반 어린이 장애 노인 국가 유공자 단체 이하 영유 무료 증빙 서류 지참 생각 볼거리 많다 포천 허브 아일랜드 산타 마을 이어지다 허브 식물 박물관 들어서다 춥다 날씨 오다 실속 따뜻하다 고맙다 곳곳 포토 있다 허브 느끼다 걷다 산타 마을 향하다 미니 동물원 당나귀 포천 허브 아일랜드 체험 관람 있다 많다 오다 가족 시선 끄다 당나귀 체험 어린아이 당나귀 먹이 주다 체험 하다 행복 표정 우리 당나귀 쓰다듬다 보다 체험 이하 어린이 당나귀 타다 체험 가능 먹다 주다 체험 가능 크리스마스 인테리어 소품 허브 힐링 센터 규모 크리스마스 마켓 진행 크리스마스 분위기 소품 구경 재미 소품 대부분 가격대 있다 메리 크리스마스 허브 제품 보다 싶다 허브 힐링 센터 가다 크다 어른 설레이다 아이 이곳 천국 싶다 허브 만들다 지다 제품 허브 힐링 센터 향기 가게 보다 있다 평소 크다 허브 관심 많다 않다 지름신 오다 하다 허브티 시음 보다 갖다 싶다 허브 온도 바르다 허브 관련 제품 구경 허브 힐링 센터 있다 제품 향기 가게 있다 향기 가게 종류 다양 같다 허브 만들다 재료 허브 가게 주차장 가깝다 있다 허브 가다 지나다 춥다 들어오다 향초 종류 분위기 엄청나다 좋아하다 라면 분위기 휩쓸리다 사다 불빛 동화 축제 이르다 시간 오다 불빛 동화 축제 한참 이곳 가게 돌아다니다 바쁘다 어둠 비추다 불빛 향기 가게 가다 빵집 마늘빵 먹다 보다 인생 이거 먹다 보다 싶다 원이 기억 어디 가다 쏟아지다 불빛 이곳 축제 크리스마스 맞이하다 정성 불빛 동화 오다 있다 어린아이 되다 나다 이르다 시간 도착 어둡다 지다 기다리다 나가다 들어오다 차량 없다 기다리다 세상 길다 보다 고기 파티 근처 숙소 예약 두다 바베큐 가능 음식 준비 하트 포천 오다 이마트 홈플러스 있다 다음 전날 이브 크리스마스 당일 조용하다 춥다 하늘 맑다 기분 좋다 먹다 찾아보다 성탄절 식사 쌈밥 좋아하다 맛있다 찾다 다니다 옹기 나쁘다 않다 기대 우렁 크기 만큼 최고 행복 포천 여행 크리스마스 지나가다 여행 다녀오다 지금 허브 아일랜드 제품 사용 구매 의사 있다 입장료 내다 찾다 않다 필요 홈페이지 웬만하다 있다"
"Blog_지름신_201701_1948","일본 여행기 일본 카페 애프터 눈티 복사 본문 기타 기능 지도 보다 번역 보다 안녕 다이어트 핑계 동안 쉬다 한때 티타임 일기 업데이트 부지런 홍차 카페인 끊다 컨디션 나쁘다 지다 끊다 성격 나쁘다 지다 오랜만 애정 일본 카페 애프터 눈티 겨울 메뉴 맛보다 가다 망상 일본 카페 여행 애프터 눈티 애프터 눈티 앨리스 페어 에디션 후쿠오카 텐진 근처 미츠코 백화점 하카 타역 근처 플라자 있다 지름신 불러오다 생활 주방 용품 애프터 눈티 리빙 둘러보다 올라가다 지용 일본 전화 상세 보다 지도 보다 프로방스 벽돌 화이트 우든 패널 고유 모스 그리다 컬러 로맨틱 세련되다 일본 카페 여기 오다 크리스마스 테마 소녀 소녀 여성 베이비핑크 메이다 컬러 메뉴판 시즌 느낌 디저트 목적 겨울 한정 메뉴 주문 그쪽 통사 캬라멜 애플 파이 홀리데이 시즌 맞추다 진하다 절이다 굽다 사과 빨갛다 라즈베리 소스 두르다 굽다 사과 풍미 좋다 소금 캬라멜 커스터드 크림 채우다 지다 연말연시 느낌 사다 디저트 여기 곁들이다 지다 아몬드 호두 럼블 크림치즈 젤라 매치 홍차 궁합 사다 오다 결심 아래층 도큐 한즈 쇼핑 정신 팔리다 들이키다 잊다 슬프다 이야기 한정 먹거리 위엄 쇼트케이크 스콘 티타임 단골 종과 홍차 나오다 애프터눈 트다 오후 주문 가능 참고 쇼트케이크 망상 되다 식사 대신 하루 종일 예쁘다 일본 카페 찾아다니다 충전 소일 행복 요즘 어쩌다 일본 오다 온천 느긋하다 굴러다니다 부르트다 쇼핑 하다 다니다 스케줄 많다 보다 오랜만 즐기다 보다 일본 카페 분위기 되다 홍차 소녀 디저트 조합 기대 이상 반갑다 관광지 돌아다니다 대신 아기 자기 일본 카페 여행 경험 보다 싶다 일정 들르다 카페 평균치 이상 되다 디저트 홍차 즐기다 있다 바라다 애프터 눈티 찾아보다 시럽 진하다 우려내다 과즙 만들다 아이스티 과일 맛보다 있다 홍차 취향 들르다 보다"
"Blog_지름신_201701_1958","일상 스타 필드 하다 다녀오다 복사 본문 기타 기능 번역 보다 안녕 주다 오헤어 우주 이번 휴무 스타 필드 하남 다녀오다 주위 다녀오다 좋다 가다 싶다 생각 이번 스타 필드 다녀오다 보다 직행버스 타다 출발 가다 시간 붓다 정도 걸리다 도착 주위 아파트 입주 하다 않다 조용하다 오른쪽 건물 있다 스타 필드 하남 외관 넓직하다 들어가다 보다 넓직하다 실내 높다 천장 다양 매장 띄이다 잠실 롯데월드 높다 하다 스타 필드 넓다 느낌 음식 매장 스타 필드 맛집 줄짓다 있다 고프다 지다 지하 위치 스타 필드 남점 준오 헤어 들어가다 보다 않다 보다 좋다 보이다 스타 필드 남점 듣다 이마트 트레이더 있다 코스트코 가다 보다 이마트 트레이더 스다 처음 신기 신기 이마트 노브랜드 유명 노브랜드 상품 팔다 있다 있다 저곳 과자 스타 필드 이마트 트레이더 스다 쇼핑 배고픔 채우다 주다 있다 간단하다 먹거리 팔다 있다 크다 피자 유명하다 조리 있다 모습 보다 있다 다양 상품 준비 놓다 우주 구경 지름신 오다 참다 시식 하다 있다 하다 놓다 쇼핑 맛나다 음식 조금 구경 스타 필드 시간 보내다 같다 여러분 시간 다녀오다 보다 넘다 좋다 스타 필드 하다 후기"
"Blog_지름신_201701_1969","탈출 해외여행 일본 후쿠오카 모모치 해변 후쿠오카 타워 캐널 시티 돈키호테 복사 본문 기타 기능 번역 보다 여자 혼자 후쿠오카 여행기 제주도 여행 끝내다 돌아오다 작년 후쿠오카 여행 포스팅 쓰다 해외여행 일본 후쿠오카 여자 혼자 후쿠오카 여행기 오랜만 후쿠오카 여행기 쓰다 돌아오다 지나다 포스팅 여깄다 일정 그렇다 빡세다 돌아다니다 보다 숙소 일본 특유 분위기 채도 빠지다 느낌 좋다 하다 날씨 아쉽다 패션 청청 패션 분위기 사랑 사스 니혼 오덕 여심 저격 헬로키티 주차장 자판기 일본 길거리 예쁘다 예쁘다 신기 일본 지하철 승차 투입 하다 나오다 일본 지하철 좌석 엄청나다 하다 텐진 지하상가 도착 일본 배라 일본 다이소 성인 용품 코너 있다 진국 감탄 아다 사람 일본 최고 인기 기념품 도쿄 바나나 로이스 초콜릿 곤약 젤리 동전 파스 있다 않다 식당 한국 소주 신기 텐진 지하상가 예쁘다 발길 멈추다 만들다 꽃집 이름 아오야마 플라워 마켓 처음 지하철 버스 타다 모모치 해변 후쿠오카 타워 가다 위하다 말투 일본 버스 신기 시스템 설명 버스 마주치다 최고 풍경 보정 하다 일본 버스 승차 각자 번호표 뽑다 다음 내리다 화면 표시 되다 본인 번호표 해당 금액 계산 되다 한국 버스 일본 버스 후불 승차 차문 달리다 있다 얼마 지나다 도착 한눈 보다 높다 웅장하다 후쿠오카 타워 이름 후쿠오카 랜드마크 관광 필수 코스 편의점 들르다 모찌 전설 모찌 구매 편의점 치다 비싸다 비싸다 예쁘다 모모치 해변 가다 귀엽다 한국어 모모치 해변 공원 날씨 꾸리 꾸리 일광욕 바다 보다 타다 가격 생각 나다 주다 여기 명물 유명 맛집 가다 모모치 해변 공원 튀어나오다 독특 위치 건물 정체 웨딩 어여쁘다 딩카 모모치 해변 공원 바다 신기 한국인 한국 한국 같다 관광지 그것 일본 한국인 후쿠오카 타워 어둡다 지다 야경 보다 자판기 보다 정신 채리다 찍다 대다 매표소 전망대 입장권 사다 예용 가격 외국인 관광객 할인 서비스 구매 있다 아름답다 후쿠오카 타워 바라보다 후쿠오카 시내 야경 잊다 못하다 후쿠오카 타워 기록 남기다 프다 스탬프 찍다 마지막 출구 있다 스탬프 연인 위하다 공간 있다 하다 가다 보다 좋다 같다 사진 찍다 주다 행랑 버스 탑승 일본 버스 특이 센스 있다 일본 노약 자석 좌석 정도 넓다 편하다 이용 있다 되다 있다 우리 일본 닮다 하다 걷다 파친코 입성 분위기 무섭다 캐널 시티 도망 여기 크리스마스 분위기 모르다 브랜드 입점 있다 전형 대형 쇼핑몰 기준 하카타 시티 예쁘다 배고프다 지다 유명 먹다 진역 도보 정도 가깝다 정확 위치 있다 기대 하다 그렇다 나쁘다 않다 수준 거기 스다 말다 아다 사람 아다 맛집 있다 찾아가다 보다 하다 뒤늦다 후회 먹다 후식 젤라 맛집 들다 다니다 후쿠오카 쿠폰 실리다 있다 쓰다 가다 쓰다 아깝다 나다 종류 엄청나다 많다 참외 실수 녹차 여기저기 돌아다니다 피곤 이끌다 후쿠오카 지하철 공항 생각 의자 좋다 당구 내리다 야식 먹다 야타이 포장마차 하다 바꾸다 진역 돌아오다 저영 야타이 일본식 포장마차 의미 후쿠오카 야타이 유명하다 나카스 텐진 나카하마 등등 야타이 집중 자리 잡다 있다 나카스 강변 끼다 운치 좋다 나카스 야타이 인기 하네 가다 텐진 야타이 지하철 타다 되다 바보 내부 쪼끄맣다 때문 이상 일행 들어가다 힘들다 부다 정도 서다 기다리다 야타이 유명 입성 교자 미니 교자 야타이 새벽 영업 야식 얼큰하다 일본 땡기다 숙소 근처 컴백 유명 돈키호테 다음 기념품 쇼핑 위하다 탐색전 하다 오다 나카스 강변 숙소 도보 거리 탐색 오다 소심하다 이치고 모찌 인생 모찌 가격 까먹다 죄송하다 돈키호테 이치고 모찌 기분 좋다 마지막 마무리 들다 떠나다 짧다 짧다 다음 길다 잡다 가다 후쿠오카 시내 돌아다니다 근교 유후인 예쁘다 돈키호테 가다 하다 친절 게스트 하우스 주인 할아버지 태우다 주다 덕분 일본 자가용 탑승 보다 진귀 경험 화려 한국어 간판 지나다 올라가다 쓸다 담다 성인 용품 코너 아이 부끄럽다 아참 용품 사다 오다 가능 걱정 하다 정도 괜찮다 유통 대량 반입 하다 않다 되다 걱정 말구 녹차 사망 채우다 담다 쇼핑 끝내다 돈키호테 면세 서비스 기준 돈키호테 외국인 한하다 이상 구매 면세 서비스 받다 있다 여권 증명 필수 전체 가량 해당 부가세 대신 면세 혜택 받다 제품 한국 도착 개봉 된다 돈키호테 기념품 리스트 가져가다 사다 오다 못하다 인기 많다 코로 젤리 곤약 젤리 동전 파스 센카 퍼펙트 에그 성인 용품 호로 시간 우마 이봉 아이 각종 화장 등등 있다 한국 판매 제품 많다 일본 돈키호테 저렴하다 구매 있다 기념품 쓸다 담다 오다 개인 강추 기념품 화장 쓰다 보다 알다 느낌 다르다 후쿠오카 떠나다 싫다 이치란 라멘 계란 세트 마지막 이치란 라멘 본점 가다 급하다 먹다 먹다 맛나다 이치란 라멘 많다 이치란 라멘 먹다 후쿠오카 가다 처음 마지막 택시 탑승 크리 일본 택시 요금 비싸다 피하다 못하다 타다 말다 후쿠오카 공항 도착 끝판 등장 면세점 로이스 초콜릿 만나다 말다 지름신 강림 이제 후쿠오카 뒤로하다 안녕 최고 로이스 초콜릿 남기다 공항 득템 하다 아깝다 녹다 사라지다 기념품 얼마 되다 뿌듯하다 뿌다 하다 생애 혼자 해외여행 후쿠오카 여행기 많다 조금 도움 되다 용기 북돋다 드리다 있다 좋다 떠나다 후쿠오카"
"Blog_지름신_201701_1972","진하다 조황 풍화리 포인트 요즘 반파 낚시 관심 반성 도보 다니다 그러다 다녀오다 낚시 이야기 찍다 사진 없다 그간 동향 하다 보다 가다 있다 알다 위치 여기 어디 같다 일본 넓다 탐나다 여기 계류 사업 하다 수입 하다 여기 내실 눕다 있다 충분하다 나다 지름신 되다 그러다 핸들 깨다 겨울 춥다 넓다 하다 기세 낚시 여기 시애틀 마린 구경 가시다 되다 흘리다 오다 좋다 업무 부산 북항 다녀오다 부산신항 경제 자유 구역 긴밀하다 관계 누리 호로 부산항 북항 돌기 하다 부산 항만 공사 진행 주다 북항 개발 계획 이때 추진 사항 들다 관심 이곳 멋지다 싶다 사진 아우라 북항 돌아보다 부산항 경제 발전 크다 하다 있다 생각 지도 부산항 신항 저기 짜다 보도 자료 신항 수심 미터 맞추다 보도 나다 크다 대형 화물선 쉽다 들어오다 있다 매력 이것 크다 장점 하다 저기 중간 있다 토도 없애다 사업 올해 발전 각설 낚시 이야기 이번 겨울 맞다 요즘 코베아 이것 사다 화력 좋다 시간 오래가다 무엇 작다 좋다 이날 바다 던지다 버리다 여기 풍화리 통영 위치 겨울철 유명 근처 잡다 올해 해거름 어렵다 사먹다 하다 잡다 경산 내려오다 죄송하다 올해 대접 시원찮다 다음 대박 대구 전동"
"Blog_지름신_201701_1975","잡곡 구매 여기 클릭 역곡 생기다 중국 식품점 있다 송화단 먹다 싶다 구경 다니다 오다 역곡 상상 시장 중간 골목 위치 있다 중국 식품점 입구 제품 진열 놓다 평수 미만 정도 아담하다 오픈 하다 얼마 되다 내부 깔끔하다 구경 보다 오른쪽 진열품 훠궈 아다 중국식 샤브샤브 전골 들어가다 육수 만드다 재료 재료 이쪽 상단 과자 사탕 조미료 종류 중국 컵라면 있다 소고기 라면 종류 보이다 이것 가다 중앙 위치 냉장고 있다 이것 샤브샤브 양고기 왼쪽 구이 양고기 송화단 사다 오다 양고기 먹다 싶다 구매 굽다 먹다 보다 안쪽 냉장고 우리 나라 족발 같다 완제품 만들다 지다 제품 오리 돼지 소세지 등등 데우다 먹다 되다 하다 왼쪽 장아찌 있다 이쪽 중국 각종 나물 모르다 구매 하다 고수 향채 구매 중국술 이상 작다 잔술 있다 공부 죽엽 청주 연태 고량주 아쉽다 작다 들어오다 하다 들어오다 하다 다음 사다 중간 중국 경주 중국 사람 먹다 하다 잔술 중국 코우 하다 먹다 모자라다 한잔 부족 이술 먹다 하다 이쪽 각종 장류 한국식 간장 고추장 등등 있다 구매 양념 되다 나오다 중간 우리 라식 양념 되다 고추장 정도 중국 사람 재료 저것 넣다 비비다 먹다 하다 사장 비비다 식사 다음 사다 먹다 보다 왼쪽 빨간색 찾다 송화단 오른쪽 파란색 송화단 피단 하다 송화단 소나무 붙히다 서다 소나무 소나무 같다 모양 예쁘다 피어나다 있다 송화단 하다 구매 재료 송화단 사다 가다 지름신 내리다 정도 송화단 사다 가다 불어나다 고수 향채 좋다 한국 사람 호불호 갈리다 해바라기 생기다 심심풀이 맛있다 예전 중국 영화 보다 주인공 무엇 씹다 있다 뱉다 버리다 장면 보다 이것 물다 해바라기 먹다 껍질 하다 버리다 하다 송화단 삭히다 꼬치 소스 중국식 향신료 양고기 먹다 보다 사람 아다 양고기 먹다 없다 돼다 양고기 맛나다 있다 굴다 먹다 중국술 문등 바이 흰색 하다 고량주 중국 산동 대표 하다 고량주 작다 없다 이거 구매 도수 연태 고량주 같다 경주 황주 붉다 구매 조리 보다 고기 자르다 얼다 잘리다 고기 주제 나오다 만드다 자르다 주다 양손 나누다 이거 칼자국 떨어지다 갈라지다 헛고생 하다 뭉떵하다 크다 자르다 후라이팬 뒤집다 익다 가다 작다 자르다 양고기 완성 양고기 소스 꺼내다 송화단 공개 생기다 소나무 꽃잎 같다 보이다 이러다 송화단 부르다 먹다 좋다 자르다 서비스 주다 두부 자르다 한상 완성 어떻다 한잔 괜찮다 경주 한잔 따르다 한잔 마시다 중국술 경주 우리 나라 백세주 비슷하다 양고기 소스 찍다 오물 맛나다 이번 고수 올리다 한입 두부 양념 없다 국물 찍다 먹다 다음 맑다 투명 한잔 마시다 도수 낮다 이다 부드럽다 두병 먹다 보다 먹다 죽다 한입 다음 송화단 송화단 좋다 하다 없다 먹다 싫다 하다 있다 않다 먹다 참기름 굴리다 한입 오랜만 먹다 변하다 맛있다 양고기 좋다 하다 소스 찍다 먹다 이번 꼬치 소스 찍다 맛있다 양고 기량 한입 치즈 양고기 송화단 고수 한입 맛나다 사먹다 필요 없다 마지막 사온 딸기 먹다 남다 커다 달다 맛있다 제철 과일 맛있다 맛있다 먹다 중국 식품점 각종 중국 음식 재료 있다 구경 가다 맛있다 사다 오다 하다 먹다 보다 괜찮다 같다 사장 중국 한국 하다 설명 하다 주다 부담 구경 가시다 되다 같다 이상 즐겁다 후기 잡곡 구매 여기 클릭 역곡동 하이 중국 식품점"
