"id","parsedContent"
"Blog_지름신_201701_4068","일상 쏘나타 돌파 복사 본문 기타 기능 번역 보다 우리 가족 태우다 달리다 되다 가다 안녕 연휴 이동 하다 시기 덕분 블로그 포스팅 적다 있다 시간 생기다 나름 기쁘다 하다 방치 버리다 포스팅 올리다 저희 가족 지금 블로그 있다 만들다 주다 녀석 대하다 이야기 하다 하다 이야기 당시 친구 모임 마치다 돌아오다 기록 남기다 역사 하다 개인 모임 있다 올해 거제 진행 하다 퇴근길 운전 하다 오랫만 거제 다녀오다 깊다 하다 모임 장소 가다 들리다 있다 들리다 되다 아다 운영 편의점 기르다 고구마 받다 오다 맛있다 감사 말씀 드리다 수령 하다 모임 장소 이동 하다 오랫만 만나다 이야기 나누다 오늘 모임 설계자 인도 받다 이동 도착 바닷가 사람 겁나다 많다 명물 보다 저희 보다 있다 감사 풍차 보다 떠오르다 있다 저다 실제 처음 가다 하다 거제 오다 보다 있다 명물 바람 언덕 오다 되다 정말 사람 많다 구경 힘들다 생각 들다 정도 오랫만 일상 지치다 사람 모이다 보다 때리다 바닷가 보다 되다 오다 물다 보다 드리다 오늘 일정 설계자 먹다 보다 싶다 하다 오다 만들다 핫도그 먹다 위하다 예전 유명 예능 나오다 나다 유명 지다 하다 친구 녀석 사다 주다 하다 넘어가다 없다 먹다 되다 일반 핫도그 하다 먹다 보다 예상 사진 표현 되다 모르다 보통 하얗다 핫도그 연초록색 보이다 맛있다 같다 생각 들다 있다 소시지 조금 다르다 보다 별도 공장 생산 같다 느낌 드다 같다 바람 언덕 보다 핫도그 이름 바람 핫도그 가다 되다 자연 들다 둘러보다 않다 생각 들다 정도 지금 쓰다 생각 드다 들리다 저녁 먹다 시간 되다 깔끔하다 가다 하다 들리다 있다 가격 대비 따지다 고기 있다 주문 하다 배부르다 저녁 먹다 나다 시간 아쉽다 자리 이동 이야기 나누다 향하다 이야기 정신 없다 결정 장애 가지다 친구 고민 해결 위하다 이야기 들다 주다 이거 중증 판단 되다 현장 구매 하다 있다 유도 하다 결과 가다 결제 이야기 진행 판매 찾아보다 대형 마트 있다 이동 하다 인근 사다 친구 동거리 때문 아쉽다 하다 지다 이동 하다 보다 찍다 되다 가다 이동 찍다 느낌 들다 친구 녀석 설득 결과 아이패드 같다 안드로이드 계열 구매 하다 가격 고려 하다 이벤트 있다 없다 확인 하다 고민 고민 해결 하다 주다 동시 지름신 부르다 물건 생기다 모르다 가다 고가 싸다 보다 구매 결정 되다 버리다 가족 쓰다 물건 결정 구매 하다 물품 지르다 모르다 있다 친구 지름신 축하 근처 바닷가 김밥 먹다 가다 위하다 이동 친구 녀석 바쁘다 보다 먼지 수두룩하다 모이다 세차 하다 까지다 얼마 남다 않다 상황 김밥 먹다 위하다 이동 하다 되다 통영 인근 보다 통영 떠오르다 단어 있다 통영 충무김밥 먹다 위하다 야심 시간 오다 되다 그러다 많다 김밥 먹다 위하다 오다 친구 추천 통하다 맛있다 하다 이동 알다 뒷골목 오다 보다 간판 보이다 본점 닫히다 있다 있다 오다 되다 처음 거기 거기 알다 친구 극찬 하다 비주얼 보다 거기 거기 생각 하다 비주얼 모르다 부분 충무김밥 먹다 기름 나오다 보다 김밥 먹다 찍다 먹다 나오다 같다 나오다 찬류 짜다 느낌 계속 들다 가지다 그러다 보다 생활 달인 나오다 하다 부착 되다 있다 정말 맛있다 가족 먹다 위하다 포장 하다 먹다 물다 보다 다음 먹다 말씀 드리다 별도 포장비 받다 않다 스티로폼 반찬 넣다 주다 충무김밥 차량 넣다 두다 항만 주위 걷다 트리 보이다 열지 않다 시간 불구하다 열다 있다 멍게 하우스 들어오다 보통 닫다 이상 않다 시간 열다 있다 이동 하다 되다 보다 밀리다 주문 제작 밤샘 판다 통영 꾸다 사다 박스 옮기다 달다 하다 옮기다 드리다 보다 받다 되다 기분 좋다 지다 친구 하다 지다 돌아가다 늘어나다 보다 있다 크리스마스 누군가 이야기 하다 차량 주기 바꾸다 타다 하다 가족 이야기 하다 저희 만족도 높다 차량 보다 힘들다 진짜 잘다 고장 따위 없다 달리다 주다 보다 폐차 몰다 다니다 생각 들다 달리다 주다 차량 보다 부품 교체 많다 그것 재미있다 모으다 작업 하다 주다 하다 쉽다 않다 마창대교 건너다 순간 흔들리다 장난 사다 달리다 동안 정말 많다 사건 사고 있다 애정 들어가다 차량 그렇다 느끼다 지다 숫자 남다르다 생각 들다 하다 새벽 쏘나타 돌파 언제 달리다 주다 모르다 작업 하다 부분 많다 하체 부품 교체 깨지다 하다 하다 고민 하다 안전 작업 하다 하다 같다 결정 대로 진행 하다 보다 하다 이야기 하다 이상 쏘나타 돌파 포스팅"
"Blog_지름신_201701_4070","밍키 코코 살다 되다 상상 먹다 구석 숨다 있다 코코 짖다 같다 코코 장난감 사다 가다 장난감 코코 사다 주다 좋아하다 같다 혼맥 홍대 피자 놀다 가다 카페 라떼 마시다 싶다 믹스 커피 우유 섞다 마다 그러다 나이 들어가다 사람 맥주 마시다 알다 요새 쿠팡 티몬 하다 지름신 충동 구매 외롭다 굽다"
"Blog_지름신_201701_4079","도쿄 나고야 겨울 일본 나고야 여행 복사 본문 기타 기능 번역 보다 행복 채우다 다음 일정 오다 노리 다케 나고야 멀다 않다 걷다 오다 있다 하다 오다 되다 닫다 시간 다가오다 건물 모이다 있다 닫다 노리다 쇼핑 하다 생각 목표 열리다 있다 이쁘다 노리 가격대 있다 보다 아웃렛 개념 이곳 싸다 않다 도쿄 커피 관련 쇼핑 하다 있다 여행 하다 예정 예쁘다 두다 가다 도쿄 일정 기준 드다 찾다 못하다 사다 않다 오다 후회 있다 하다 사이 보다 찍다 보다 좋다 하다 넘다 지름신 강림 접시 사진 보다 후회 되다 여행 생각 말다 사다 나중 후회 없다 같다 막사 야지 이상 다짐 노리 다케 일정 얼다 마무리 오스 시장 이동 예쁘다 트리 빨갛다 오스 시장 마네키네코 겨울 일본 여행 분위기 내주다 오스 시장 큼지막하다 기준 둘러보다 되다 걷다 하다 나름 구경 보다 있다 대신 간식 체력 채우다 일본식 당고 따뜻하다 먹다 보다 싶다 짭짜름하다 쪼다 취향 이놈 붕어빵 우리 나라 많다 먹다 보다 말다 고민 하다 들다 같다 들다 시도 보다 하다 검은깨 가다 먹다 중간 포기 없다 유명 앨리스 작다 유명 같다 들어가다 보다 않다 지나다니다 사진 찍다 추리다 여기 카다 커피 아쉽다 분위기 좋다 나중 커피숍 느낌 내다 싶다 하다 찍다 나고야 핸드 드립 유명 들어가다 보다 않다 후회 아쉽다 후회 많다 계속"
"Blog_지름신_201701_4089","우리 쉬다 복사 본문 기타 기능 번역 보다 판교 귀요미 발견 데려오다 싶다 노트 이과 독해 꾸다 바로우 순간 넘다 병맛 게임 아쥬 내스 재밌다 오락실 게임 정하다 내기 농구 이기다 지다 노량진 싸다 맛나다 잠실 빌즈 클로 지다 배신 버리다 지다 분노 사랑 사람 이상 사랑 않다 좌절감 크다 의미 다가오다 비참 소용 당장 사랑 사람 사라지다 내일 두렵다 마당 쓰다 후기 공감 사케 맥주 섞다 작가 이중생활 안주 완전 자극 내수 탄탄 메다 최고 맛있다 해장 아다 나이스 지름신 결과 응가 우유 호빵 최고 없다 파스타 먹다 보다 하루 천하 끝나다 가슴살 맛있다 도라 애피타이저 제격 아몬 고구 크림치즈 맛있다 들어가다 있다 머리 드다 낭만 갖다 살아가다 이것 저장 넘쳐나다 메모장 깊다 지다 우리 러블리 보다 나다 행복 지다 영화 웃다 달려오다 초딩 달다 살다 먹다 생일 선물 받다 썩다 않다 이빨 용하다 이거 좋다 하다 만우 애정 담기다 시스 되다 하루 앙금 먹다 싶다 맛없다 비싸다 맛없다 개미 닮다 우리 에디션 스다 두꺼비 화로구이 비싸다 적다 맛있다 유자 머물다 맥주 맛있다 대창 전골 토이 스토리 스스 믿다 인생 여한 피우다 보다 진심 기원 먹다 보다 청포 맛있다 버블티 사랑 내방 가다 애증 사이드쇼 차돌박이 떡볶이 설레다 주다 크리스마스 분위기 올해 보다 트리 트리 입꼬리 올라가다 사람 맛없다 힙스터 꿈꾸다 자라 지르다 니트 수세미 같다 해시 귀빠지다 빠지다 우리 가다 되다 머리 넘다 귀요미 행복 크리스마스 이브 보버 라운지 피타 식전 샴페인 새다 러두 스프 파스타 스테이크 스탈 와인 후식 디저트 완벽 위하다 아끼다 두다 블라우스 넘다 들다 당림 그거 같다 크다 대왕 트리 뿌다 이거 명동 있다 벤츠 트리 가깝다 지다 사이 선방 자라다 세일 참새 방앗간 지나치다 없다 삼총사 루프 엑스 삼총사 스노우 걷다 찌다 마지막 술자리 연말 술자리 많다 앨범 보다 냄새 사진 혼자 심심하다 되돌다 보다 밀리다 밀리다 안녕 예쁘다 그대 지다 그때 우리 쉬다"
"Blog_지름신_201701_4090","아이 가다 좋다 송도 현대 프리미엄 아울렛 즐기다 송도 아울렛 맛집 지도 포함 복사 본문 기타 기능 번역 보다 오늘 우리 죠죠 엄마 아빠 가족 데이트 하다 하다 주다 가족 보내다 하다 어디 가다 고민 결정 아이 가다 좋다 송도 현대 프리미엄 아울렛 가다 하다 송도 현대 프리미엄 아울렛 교보 하다 키즈 까페 회전목마 아이 놀다 있다 많다 맛있다 맛집 쇼핑 하다 있다 일석 장소 때문 주차 하다 올라오다 우리 유혹 맛집 빵집 유명 수박 빵집 빵집 삼송 빵집 유명 베이커리 작다 있다 있다 마트 애견인 위하다 시한 애견 애묘 위하다 꽃집 테리어 있다 지상 올라오다 보다 서다 전이 그렇다 세일 하다 있다 클레르 알마니 발망 발리 페레 가모 등등 이자벨 마랑 세일 있다 성인 아이 용품 아이 장난감 아이 세일 하다 있다 상품 세일 하다 폭스바겐 미니버스 파파야 경찰차 인터넷 저렴하다 지름신 오다 신랑 참다 보통 아울렛 장난감 가게 하다 인터넷 가격 비싸다 상품 저렴하다 아다 사람 오다 사다 가다 하다 브이 제품 있다 직원 친절 놀다 나오다 쇼핑 깨끗하다 유아 휴게실 죠죠 기저귀 가다 고손 씻기다 나다 출출하다 지다 디저트 후식 사다 도레 도레 시작 이곳 저곳 들르다 먹다 커피 사다 입점 있다 고르다 결정 장애 오다 피자 피자 팝업 스토어 하다 있다 가다 들다 보다 용하다 식사 하다 찾다 도움 있다 식당 알리다 드리다 저희 점심 먹다 고민 고민 죠죠 앉다 여유 먹다 하다 같다 지하 푸드 코트 지상 있다 이스트 바이 게이트 먹다 이스트 바이 게이트 태국 요리 태국 음식점 팟타이 갈릭 라이스 시키다 오우 맛있다 푸짐하다 최고 배부르다 맛있다 먹다 아기 의자 있다 아기 식기 준비 있다 태국 요리 좋다 하다 라면 추천 평일 가다 그렇다 주차 없다 아울렛 사람 비다 있다 편안 여유 쇼핑 키즈 까페 아이 데이트 하다 갈만 찾다 이곳 송도 현대 프리미엄 아울렛 어떻다 해복 받다 행복 연휴"
"Blog_지름신_201701_4104","홍콩 마카오 홍콩 마카오 자유 여행 복사 본문 기타 기능 지도 보다 번역 보다 홍콩 자유 여행 다녀오다 여행 홍콩 마카오 새해 시작 고생 덕분 가다 되다 여행 동안 고생 많다 축하 이쁘다 홍콩 달러 정도 환전 가다 사라지다 느끼다 못하다 이번 가다 홍콩 물가 사다 지름신 내리다 탕진 해외 처음 카드 긁다 다니다 편하다 하다 카드 수수료 생각 아침 기라 새벽 일어나다 리무진 타다 인천 공항 도착 새벽 도착 여행 가다 사람 많다 새벽 붐비다 보다 연초 그렇다 모바일 체크인 놓다 겁나다 길다 기다리다 관계자 기다 주다 끊다 이동 주다 탑승 시간 여유 없다 대기 있다 내려가다 포켓 이파 찾다 갖다 오다 기다 들어가다 우리 도장 찍다 신경 쓰다 자동 출입국 심사 이용 예전 자동 출입국 심사 등록 되다 밀다 발급 받다 국민 등록 하다 가능 쓰다 있다 언니 끄다 면세 사다 립스틱 주다 찾다 탑승 고다 홍콩 가다 돌아오다 얼리 체크인 하다 대하다 항공 알다 보다 지나다 편하다 이용 이번 부탁 되다 일본 가다 홍콩 시간 시간 정도 겁나다 보다 듣다 시간 길다 보다 지루하다 헤드폰 사용 대한항공 통수 기대 부분 불편 좌석 넓다 하다 베개 갖다 오다 불편 불편 멀다 멀다 후쿠오카 예매 놓다 후쿠오카 가다 창문 더럽다 항공 저번 타다 대한항공 기내식 더럽다 없다 하다 이번 괜찮다 오믈렛 선택 그러다 요플레 파인애플 맛있다 흔들리다 사진 오믈렛 브로콜리 하다 없다 하다 포테이토 맛있다 위염 장염 겹치다 좋다 계란 오믈렛 먹다 좋다 아프다 햇빛 하다 찍다 보다 찍다 모르다 대사 바보 커플 입국 신고 작성 한참 우리 마카오 가다 오다 마카오 홍콩 들어오다 작성 제출 호텔 주소 일정표 쓰다 오다 쓰다 놓다 나이 먹다 무엇 까먹다 덜렁거리다 요새 난리 우리 가다 표시 되다 있다 하다 지나다 홍콩 여행 우기다 하다 놓다 날씨 넘다 맑다 괜찮다 하다 내리다 되다 날씨 흐리다 이번 홍콩 날씨 흐리다 우기 방울 오다 오다 하다 비오다 보슬비 하다 홍콩 익숙하다 보이다 있다 없다 지다 하다 있다 허유 없다 지다 도착 정두 점심 먹다 하다 알다 보다 그레 있다 짜다 미스 없다 하다 늙다 보다 사진 있다 오다 옥토퍼스 카드 구매 편의점 옥토퍼스 카드 되다 많다 충전 놓다 다니다 편리 우리 중간 중간 충전 사용 마지막 기념 갖다 가다 환불 버스 보다 홍콩 오다 실감 나다 점심때 도착 공항 먹다 하다 먹다 만하다 없다 하다 예전 먹다 보다 침사 추이 가다 먹다 하다 버스 타다 고고 버스 타다 싶다 의견 버스 탑승 걸리다 걸리다 벌다 침사 추이 붓다 정도 걸리다 모르다 알다 보다 택시 초록색 붙다 있다 저거 타다 있다 사람 수라 쓰다 지다 있다 있다 다양 다양 택시 타다 궁금하다 기본 요금 달러 아래 달러 붙다 하다 캐리어 달러 추가 야박 우리 나라 택시 비싸다 버스 타서 택시 얘기 있다 버스 타다 올라가다 계단 있다 예전 올라가다 하다 자리 없다 서다 가다 오다 올라가다 앞자리 타다 되다 되다 하다 오다 감흥 캐리어 보관 올라가다 되다 불안 캐리어 보다 있다 화면 있다 하다 불안 불안 걱정 인형 하다 시내 들어가다 경치 구경 하다 시내 들어오다 막히다 앉다 휴식 역방향 좌석 있다 반갑다 사사 저번 오다 그렇다 이번 그렇다 사사 인연 없다 사다 하다 가다 보이다 사다 나오다 놓다 마지막 돌아가다 생각 나다 사다 후회 이번 컨디션 최악 와중 먹다 돌아다니다 홍콩 마카오 여행 일정 여유 있다 짜다 먹다 쇼핑 여유 돌아다니다 홍콩 마카오 여행기 시작 홍콩 국제 공항 홍콩 전화 상세 보다 홍콩 국제 공항 지도 보다"
"Blog_지름신_201701_4105","스테이크 얼마 비주얼 넘치다 스테이크 방송 나오다 지름신 발동 과감하다 지르다 버리다 손쉽다 스테이크 하다 먹다 있다 때문 먹다 방송 보다 먹다 싶다 충동 견디다 내다 못하다 도착 스테이크 궁금증 요리 먹다 보다 포장 되다 스테이크 내용 열다 보다 종류 소스 들다 있다 열다 보다 손바닥 크기 진공 포장 나오다 크기 생각 작다 쇼핑 낚다 기분 간단하다 조리 있다 편하다 배송 오다 상태 냉동 상태 전자 렌지 돌리다 해동 레이 요리 하다 간편하다 보다 먹음직하다 굽다 지다 스테이크 간단하다 소스 뿌리다 먹다 보다 먹다 좋다 자르다 시식 보다 생각 좋다 않다 간편하다 요리 먹다 있다 좋다 하다 스테이크 체질 바요 딸아이 먹다 하다 하다 아들 녀석 먹다"
"Blog_지름신_201701_4109","멀다 나라 이웃 나라 싱가포르 싱가포르 일차 복사 본문 기타 기능 번역 보다 싱가포르 오늘 코스 코스 마리 나베이 샌즈 호텔 마리 쇼핑몰 마칸 수트라 센터 머라이언 파크 인피니티 차이나타운 체크아웃 마리 나베이 샌즈 호텔 이동 유명 카야 토스트 본점 아침 해결 하다 가다 지하철 타다 가다 먹다 보다 싶다 보이다 달려가다 바베큐 치킨 소스 하다 피다 넣다 그렇다 매우다 칠리소스 하다 피다 그러다 오다 오다 마리 나베이 샌즈 죽다 자다 보다 행복 사람 털다 도착 얼리 체크인 하다 있다 배정 주다 없다 캐리어 맡다 두다 숙소 올리다 주다 우리 배정 받다 사이 있다 조형 건물 들이다 만들다 거미줄 같다 숙소 입성 창문 보다 가다 바이더 베이 보이다 새다 키다 지다 있다 카드 꽂다 커튼 자동 열리다 신기 카드 꽂다 쳐다보다 화장실 크다 여기 살다 쇼핑몰 사다 싶다 쇼핑 리스트 사다 말다 여기 찰스 키스 포라 쇼핑 리스트 브랜드 모이다 있다 카페 보다 싶다 비싸다 보이다 세포 화장품 가다 마스크 사다 말다 금강산 식후 쇼핑 먹다 시작 서브웨이 고르다 먹다 아이스크림 거트 아이스크림 저거 하다 비우다 원하다 한국 없다 오다 싶다 여기저기 돌아다니다 맡아보다 사면 공짜 주다 이벤트 기간 지름신 오다 결과 여기 달러 화로 유명 차도 사다 달러 한화 정도 한국 돌아가다 먹다 보다 싶다 오늘 쇼핑 결과 정도 되다 아끼다 여기 쏟다 어쩌다 보다 동전 화폐 종류 모이다 찍다 똑같다 얼굴 신기 왼쪽 마크 투명 필름 같다 같다 비닐 같다 찢어지다 않다 신기 방기 쇼핑 싱가포르 먹다 하다 칠리 크랩 먹다 출동 마리 쇼핑몰 먹다 하다 비싸다 마칸 수트라 센터 향하다 걷다 마칸 수트라 맞은편 보다 마리 나베이 샌즈 보이다 좋다 칠리 크랩 볶음밥 서비스 주다 감사 크랩 매콤하다 하다 소스 번이 볶음밥 먹다 먹다 죽다 모르다 보다 돌기 여기 리버 크루즈 하다 같다 돌아다니다 리버 크루즈 한국 티켓 사다 가다 싸다 사다 패스 마리 나베이 샌즈 안녕 강변 따라가다 보다 머라이언 파크 나오다 랜드마크 입성 머라이언 파크 사람 이러다 있다 보다 위하다 돌아가다 넘다 예쁘다 기본 찍다 슈퍼 트리 하다 눕다 대기 찍다 이쁘다 넘다 이쁘다 시작 중간 아리랑 나오다 나라 노래 나오다 같다 음악 마추다 서다 조명 움직이다 예쁘다 분간 황홀 공연 시간 오후 수영복 갈다 입다 위하다 숙소 숙소 이것 넘다 이쁘다 하루 종일 감탄 하다 여기 있다 같다 인피니티 여기 수영 보다 소원 소원 성취 늦다 오다 시간 하다 황홀"
"Blog_지름신_201701_411","사용 후기 복사 본문 기타 기능 번역 보다 쇼핑 유명 주부 사다 보다 굽다 연기 나다 쇼핑 메다 혹하다 지르다 지르다 지름신 강림 자이 박스 설명서 설치 방법 자세하다 적히다 있다 볶다 먹다 마련 있다 마늘 굽다 고기 입성 고기 마늘 콜라보 펴다 오다 분전 굽다 시작 하다 쇼핑 굽다 지다 거짓말 자이 단점 고기 굽다 속도 느리다 먹다 짜다 굽다 지다 보이다 저기 보이다 가운데 동그랗다 구멍 기름 빠지다 굽다 삼겹살 베이컨 되다 참고 엄니 기르다 배추 익다 삼겹살 올리다 야무지다 굽다 지다 사용 후기 장점 기름 빠지다 냄새 나다 않다 기름 튀다 않다 연기 없다 단점 불빛 주황색 고기 익다 익다 보이다 않다 기름 빠지다 베이컨 익다 속도 느리다 먹다"
"Blog_지름신_201701_4113","안녕 이스 오랜만 쓰다 오늘 업로드 하다 계획 실천 브이 수원역 사다 가다 넘다 쓰다 버리다 오다 지름신 강림 사진 없다 재밌다 보아주다 심상하다 않다 추천 친구 오랜만 사다 수원역 다녀오다 도착 스타 벅스 무료 쿠폰 있다 스타 벅스 가다 스타 벅스 딸기 거트 딸기 좋다 하다 네이버 추천 메뉴 검색 시키다 맛있다 크다 사이즈 많다 하다 딸다 크다 크다 들다 있다 강추 섞이다 빨대 섞다 마시다 거트 딸기 섞이다 맛있다 블로그 보다 찍다 스타 벅스 있다 악세사리 가게 들어가다 목도리 유행 이길래 친구 사다 블랙 그레이 화이트 베이지 화이트 사다 따뜻하다 이쁘다 나름 만족 여기 들다 있다 진청 에코 사다 이쁘다 수납 마음 들다 지르다 거울 다리 얇다 보이다 좋다 탐나다 스테이크 스테이크 정식 쇼핑 중간 먹다 스테이크 가다 스테이크 정식 맛있다 같다 배고프다 집어먹다 뒤늦다 찍다 그러다 사촌 동생 선물 사고 애기 라이 언덕 사다 버리다 사진 없다 뒤늦다 찍다 스테이 맨투맨 어깨 넓다 보이다 이쁘다 사다 버리다 배색 맨투맨 꽂히다 버리다 스테이 원피스 찍다 깨닳다 사진 찍다 단추 뷔스 원피스 사다 싶다 쇼핑몰 짧다 길다 이거 무릎 오다 사다 버리다 루저 오다 파리 바게트 들리다 이것 딸기 파티 열리다 마지막 들리다 후회 없다 그지 넘다 딸기 조각 넘다 비싸다 보이다 이상 급하다 말다 물다 하다 보다 주중 회이 올리다 계획 보아주다 오늘 보다 주다 감사"
"Blog_지름신_201701_4117","해외여행 일본 쇼핑 리스트 후쿠오카 여행 쇼핑 캐널 시티 쇼핑 복사 본문 기타 기능 번역 보다 지나다 회사 워크 일본 다녀오다 료칸 이용 온천 즐기다 유후인 마을 가다 후쿠오카 돌아오다 캐널 시티 쇼핑 하다 워크 일본 여행 후기 나중 올리다 하다 이번 일본 사온 물품 공개 이번 먹다 사다 오다 과자 주전부리 좋다 하다 않다 오니츠카 타이거 운동 디즈니 구입 라멘 유후인 마을 장인 나무 깍다 만들다 따다 수제 젓가락 잔돈 남다 구입 비오다 다양 그림 유명 속옷 일본 쇼핑 베스트 호로 휴식 넣다 주다 수면 안대 국내 면세 구입 립글로스 수분 크림 추가 아빠 선물 구입 담배 없다 캐널 시티 있다 디즈니 구입 커플 머그잔 세트 정도 같다 지름신 구입 아깝다 그러다 나름 이쁘다 위로 오니츠카 타이거 신상 한국 저렴하다 구입 가다 신상품 하다 구입 오니츠카 타이거 상징 갈기 없다 로고 박히다 있다 작다 보이다 이쁘다 이거 후쿠오카 공항 면세점 라멘 라멘 그것 유명 아무거 집다 구매 먹다 보다 않다 맛있다 이거 일본 술잔 세트 좋다 하다 끊다 하다 나름 줄이다 의미 작다 사다 따르다 마시다 이거 유후인 마을 돌아다니다 구입 젓가락 세트 정도 주다 사진 흔들리다 보이다 황금 부엉이 박히다 있다 황금 부엉이 일본 행운 상징 하다 젓가락 장인 나무 깍다 만들다 수제 젓가락 사장 말씀 튀김 젓가락 주다 이것 일본 가다 구입 오다 수면 안대 쓰다 보다 오다 좋다 하다 피로 올리브 가다 있다 거기 하다 일본 일본 여행 가시다 살다 고민 참고"
