"id","parsedContent"
"Blog_지름신_201701_1005","타이완 대만 이페이 이페이 대표 야시장 스린 야시장 중정 기념 야경 복사 본문 기타 기능 지도 보다 번역 보다 여행 바뀌다 지나다 여행 후기 작성 있다 지독 으름 여행 마지막 일정 스린 야시장 중정 기념 야경 사진 풀다 보다 하다 스린 야시장 타다 베이터우 환승 지다 타다 하차 도보 붓다 보이다 대만 찾다 이유 야시장 먹거리 유명 이다 하리다 대만 유명 스린 야시장 거리 마음 먹다 주다 자신감 무장 들르다 하루 종일 걸어다니다 다리 아프다 힘들다 늦다 시간 머물다 없다 주다 서서 기다리다 사람 대만 우리 나라 맛집 소문나다 어디 대번 나다 줄다 있다 나름 현지인 관광객 이름 알리다 지다 무엇 먹다 하다 고민 길다랗다 사람 찾다 되다 길다 하다 한국 사람 입맛 맞다 보장 하다 없다 골목 골목 먹거리 장사 즐비하다 맛있다 보이다 야시장 별미 튀김 향신료 냄새 오징어 통째 튀기다 내다 어디 쉽다 보다 있다 대왕 오징어 튀김 이어폰 감개 구매 묶다 사용 대만 여행 카페 있다 토토로 전등 야시장 어디 가다 있다 품목 귀염 귀염 이어폰 감개 토토로 장식품 여행 대만 여행 카페 보다 토토로 스탠드 띄다 여행 마지막 일정 지갑 열다 모르다 사고 싶다 남다 일정 되다 싶다 돌리다 버리다 스린 야시장 스린 스린 야시장 대만 지도 보다 실내 이어지다 스린 야시장 입다 왼쪽 유명 크다 닭다리 튀김 파다 있다 실내 지하 매장 있다 손바닥 크다 닭다리 튀김 괜찮다 먹다 수록 자극 짠맛 느끼하다 느끼다 지다 저녁밥 대용 생각 먹다 하다 나중 느끼하다 결국 콜라 마시다 혼자 먹다 많다 먹다 좋다 크기 지하 있다 크다 들다 다니다 먹다 느끼하다 참다 못하다 콜라 사먹다 실내 위치 다양 놀이 체험 실내 점포 풍경 야시장 실내 점포 다양 놀이 체험 풍선 터트리다 미꾸라지 잡다 마작 핸드폰 케이스 가방 기념품 판매 있다 우리 나라 축제 야시장 느낌 풍기다 지하 음식점 풍경 실외 점포 실외 점포 실외 다양 가게 즐비하다 이곳 휴대폰 케이스 판매점 인형 뽑다 게임 가게 많다 저렴하다 보이다 식기 판매 있다 눈길 사로잡다 사다 싶다 지름신 떨치다 내다 먹다 아기 자기 저렴하다 식기 야시장 실외 점집 점집 있다 중국어 하다 알다 보다 재미있다 같다 삼성 매장 삼성 매장 보다 애플 꺼만 사용 중정 기념 야경 지엔 방면 타다 중정 기념 하차 도보 지치다 힘들다 와중 숙소 근처 중정 기념 야경 찍다 하다 열망 강하다 결국 돌아오다 들르다 내리다 우산 받쳐들다 카메라 누르다 대다 어둠 짙다 깔리다 거기 내리다 혼자 청승맞다 넓다 광장 누비다 있다 쓸쓸하다 무섭다 하다 날씨 야경 찍다 찾다 커플 전문 사진가 보이다 중년 남자 보다 나름 위안 되다 중정 기념 자유 광장 국가 음악 중정 기념 중정 기념 중정 기념 대만 지도 보다 온천 하다 빠지다 걸어다니다 힘들다 그러다 멋지다 풍경 담다 사진 남기다 있다 행복 이페이 식물원 숙소 화원 신베이터우 베이터우 도서관 지열 아타미 호텔 온천 스린 야시장 중정 기념 야경"
"Blog_지름신_201701_1007","라오스 동남아 여행 루앙프라방 탐방 야시장 쇼핑 복사 본문 기타 기능 번역 보다 동남아 여행기 태국 라오스 캄보디아 베트남 예행연습 라오스 루앙프라방 탐방 거리 따르다 걸어가다 메콩 카다 만나다 리버 공원 있다 더위 식히다 공원 경치 감상 한적 공원 부다 바람 맞다 명상 잠기다 느긋하다 시간 여유 보내다 있다 감사 리버 공원 사카리 따르다 걷다 보다 양쪽 수많다 사원 보이다 시작 어리다 탁발승 사다리 타다 크다 관등 달다 있다 모습 귀엽다 루앙프라방 어린이 신기 듯이 쳐다보다 있다 사카리 걷다 왼쪽 골목길 내려가다 카다 보이다 흙탕물 색깔 물줄기 메콩 향하다 흘러가다 있다 타임 랩스 영상 카다 강변 따르다 내려오다 조마 베이커리 보이다 사람 없다 입구 어디 영업 하다 모르다 들어가다 보다 생각 다음 기약 발걸음 돌리다 빨간색 지붕 발견 여기 어디 쳐다보다 불상 보이다 사원 생각 올라가다 보다 살다 중간 올라가다 보다 석양 지다 무렵 올라오다 같다 여기 어디 모르다 공간 협소하다 동굴 불상 있다 식민지 시절 문화유산 보존 위하다 동굴 옮기다 모르다 라오스 읽다 없다 답답하다 따름 그림지도 꼭대기 사원 있다 같다 살다 정상 오르다 위하다 입장료 지불 하다 입장료 사다 보다 정상 황금색 있다 알다 되다 루앙프라방 경험 하다 가지 올라가다 신성 오르다 루앙프라방 전경 일몰 감상 하다 있다 올라가다 요일 불상 있다 루앙프라방 바라보다 고층 빌딩 필요 없다 바라보다 전망 아름답다 하다 하얗다 주인 기다리다 있다 집사 어디 가다 오르다 힘들다 않다 올라오다 하늘 도전 솟아오르다 황금색 쪼다 루앙프라방 석양 보다 있다 일몰 시간 맞추다 올라오다 다행 타이밍 석양 감상 올라오다 관광객 북적이다 관광객 주변 사람 의식 않다 자기 시끄럽다 민폐 사진 동영상 촬영 서양 친구 가로막다 자기 사진 찍다 돌입 일부 몰지각 행동 하다 패키지여행 관광객 때문 배낭 여행 오다 어리다 친구 먹다 하다 상황 안쓰럽다 아름답다 석양 바라보다 여행자 올라오다 되다 무계획 계획 여행 자연 하다 자신 보다 상황 맞다 대처 있다 생각 들다 대견하다 자신 칭찬 하다 주다 하다 않다 쓰다 쓰다 내려가다 준비 하다 있다 어리다 승려 대화 모습 보이다 사진 담다 새벽 탁발 참관 주황색 승복 입다 탁발승 보다 내려가다 패키지 관광객 줄짓다 내리다 가다 루앙프라방 경험 하다 가지 야시장 쇼핑 우체국 있다 사거리 루앙프라방 야시장 열리다 시작점 저녁 시장 열리다 장소 여행자 거리 수많다 사원 숙소 현지 여행사 음식점 모이다 있다 올라가다 내리다 보다 야시장 전경 비엔티안 야시장 만큼 규모 크다 라오스 여행자 기념품 사다 있다 하다 공예품 전통 의상 등등 많다 물건 있다 둘러보다 구입 가격 흥정 필수 가격 흥정 적당 금액 깎다 좋다 같다 하다 야시장 구경 가다 쇼핑 지름신 강림 버리다 코끼리 반바지 오다 코끼리 저렴하다 구매 루앙프라방 저녁 식사 야시장 가격 하루 종일 걸다 고프다 국물 비우다 나라 가다 시장 음식 맛나다 같다 그렇다 후식 망고 바나나 파인애플 주스 동남아 여행 하다 생과일 쥬스 마시다 다니다 같다 오늘 하루 짧다 길다 같다 오다 내일 새벽 탁발 참관 들어가다 수면 모드"
"Blog_지름신_201701_1009","요즘 날씨 덥다 멜번 덥다 날씨 믿다 어렵다 덥다 케언즈 비하다 아무것 요즘 있다 보다 하다 오류 하드 정리 하다 보다 떠나다 시간 없다 게으름 집어넣다 영어 공부 하다 하다 영어 호다 생활 떨어지다 않다 과제 일전 잡다 외장 하드 사다 가다 외장 개다 있다 용량 부족 지름신 오다 보다 위치 거리 가깝다 망하다 지하 있다 넓다 없다 없다 관심 가다 가지다 다니다 힘들다 재다 필요 띄우다 되다 땡기다 가격 생각 비싸다 드론 상공 찍다 비디오 보다 있다 하늘 듯하다 기분 느끼다 있다 외계 비행 물체 같다 튼튼하다 보이다 사다 싶다 요거 디즈니 인형 취향 귀엽다 개인 대두 프로 스쿠버 다이빙 하다 필요 필수품 케언즈 오픈 라이센스 사다 하다 포기 멜번 비싸다 같다 할인 크다 하다 사다 생각 있다 사다 고르다 무엇 고르다 하다 살다 회사 외장 하드 만드다 회사 때문 회사 부품 공급 받다 조립 하드 오류 적다 좋다 호다 받다 보다 없다 외장 하드 있다 크다 세일 일전 살다 시계 요즘 유행 스마트 와치 비교 보다 아날로그 스타일 지제 시계 만족 요즘 노래 듣다 보다 음악 시디 패스 하다 다음 훑다 보다 가다 우동 발견 나오다 왼쪽 올라가다 나오다 싸다 같다 들다 가다 계산 하다 하다 싸다 않다 기본 먹다 싸다 우동 국물 시키다 그릇 크다 하다 가다 적다 생각 새우 추가 계산 보다 셀프 양념 선반 있다 토핑 추가 하다 있다 요거 공짜 처음 우동 국물 없다 생각 들다 적다 용서 되다 토핑 넣다 보다 그럴싸하다 보이다 전체 토핑 우동 콜드 우동 토핑 어울리다 보이다 새우 우동 그릇 면발 맛있다 익다 국물 스프 하다 아쉽다 토핑 미역 가쓰오부시 무우 있다 기호 따르다 식성 따르다 추가 하다 있다 토핑 메뉴 따르다 조합 편하다 가다 같다 가게 깨끗하다 못하다 느낌 중요 지인"
"Blog_지름신_201701_101","실내 정원 식물 폭풍 지름신 위치 동명사 거리 복사 본문 기타 기능 지도 보다 번역 보다 공산 화원 가다 폭풍 지름신 오다 화분 사다 오다 저것 분갈이 하다 바쁘다 같다 부자 되다 기분"
"Blog_지름신_201701_1015","정보통 코스트코 연어 샐러드 녹다 느낌 아다 복사 본문 기타 기능 번역 보다 먹다 아이 좋다 하다 많다 연어 진작 코스트코 가다 연어 샐러드 사다 달다 아이 생각 오늘 저녁 먹다 위하다 사다 들다 오다 필요 사다 오다 싶다 가다 필요 많다 자제 하다 지름신 강림 연어 아이 성장 좋다 중년 이후 골다공증 인하다 골절 예방 좋다 고혈압 동맥 경화 혈관 질환 좋다 보다 우리 아이 생선 좋다 하다 않다 되다 코스트코 연어 샐러드 먹다 연어 샐러드 뿌리다 지다 소스 좋다 보다 녹다 연어 단백 기름지다 하다 먹다 나다 다음 피부 기름지다 있다 하다 생각 하다 먹다 자라나다 아이 위하다 가다 빼놓다 않다 사다 오다 생선 되다"
"Blog_지름신_201701_1025","홍콩 마카오 동남아 여행 여행 일기 홍콩 수영장 빅토리아 피크 홍콩 야경 레몬 위치 복사 본문 기타 기능 지도 보다 번역 보다 걷다 아침 일어나다 못하다 일어나다 홍콩 조식 뷔페 키친 굽다 굽다 음식 종류 많다 먹다 보다 먹다 음식 질리다 않다 주스 오늘 오후 쉬다 호텔 패키지 느낌 있다 어제 사람 많다 주말 일다 끼다 중국 사람 주말 여행 오다 싶다 오후 떠나다 사람 떠나다 오늘 오후 나가다 보다 있다 수영장 세계 있다 수영장 간식 먹다 맥주 한잔 이거 유유자적 상팔자 버들 팔자 사진 이쁘다 찍다 분위기 있다 찍다 포기 씌다 수영하다 놀다 이거 썰다 끼다 사진 찍다 보다 주다 수경 끼다 놀다 사우나 가다 홍콩 주변 살펴보다 지지다 피로 풀다 돌아오다 배고프다 허기지다 분노 차다 사다 놓다 여행 시작 보다 하다 타다 굽다 굽다 오늘 여행 하다 다니다 사람 많다 내추리 하다 다니다 주눅 들다 크리스탈 제이드 맛있다 탄탄 샤오롱바오 먹다 먹다 나다 표정 공개 하다 애쓰다 표정 대신 설명 없다 이페이 레스토랑 최고 바오 이페이 오지 최고 이페이 체질 봉가 시무룩하다 레몬 가다 지름신 오다 그분 오다 종류 이것저것 사고 필라테스 하다 여자 필라테스 레몬 입다 그러다 걷다 피크트 타다 굽다 굽다 많다 인파 제치다 피크트 타다 빅토리아 피크 빅토리아 피크 보다 홍콩 야경 오늘 미세 먼지 안개 끼다 흐릿하다 하다 높다 보다 홍콩 야경 좋다 사람 많다 힘들다 길다 버스 타다 센트럴 오다 병우 아들 운전 코너링 뛰어나다 산길 부드럽다 코너 하다 주다 예술 유유자적 지내다 사다 사고 홍콩 오다 하다 보다 오늘 일정 블로그 보다 버스 달러 잔돈 바꾸다 주다 한국 어리다 여자 감사 차다 고맙다 하다 인사 못하다 같다 걸리다"
"Blog_지름신_201701_1039","하루 생각 교보문고 팔다 있다 않다 복사 본문 기타 기능 번역 보다 오랜만 교보문고 가다 아침 가다 사람 적다 좋다 대부분 인터넷 사다 보다 교보문고 오랜만 가다 보다 서점 가다 나름 분위기 있다 좋다 같다 가다 보다 교보문고 많다 바뀌다 처음 가다 꽃집 있다 교보문고 알다 서점 팔다 발상 독특 어울리다 조그맣하다 미니어처 팔다 있다 깜놀 치중 하다 느낌 들다 인터넷 주문 때문 서점 오다 변화 주다 있다 생각 서점 가다 지름신 하다 절제 하다 구경 하다 오다"
"Blog_지름신_201701_1050","베를린 브뤼셀 비행기 지름신 오다 지르다 주다 하다 복사 본문 기타 기능 번역 보다 마음속 베를린 있다 베를린 사다 외치다 있다 사람 어떻다 되다 모르다 계획 취업 전선 들어가다 예정 찾아오다 혹한기 겨울 맞다 가다 싶다 아이슬란드 가다 척박하다 보이다 가다 예정 느낌 남다 기분 이탈리아 가다 오다 런던 떠나다 문제 중순 여행 갔다오다 계속 나가다 싶다 잇다 부르다 있다 정도 겨울 왕국 가다 싶다 라이언에어 보다 이벤트 싸다 싸다 올라오다 나라 있다 질르다 하다 주다 베를리너 그녀 스페인 있다 사실 베를린 위도 낮다 스페인 겨울 가을 겨울 넘어가다 단계 하다 있다 사진 보다 파랗다 하늘 장난 하다 무엇 가우디 가다 하다 나라 리스본 바르셀로나 있다 가다 가다 하다 되다 엎지르다 지다 가다 작다 나라 모습 어떠하다 생각 프라하 정도 되다 같다 이곳 다르다 많다 유럽 가다 보다 못하다 같다 생각 디테일 다르다 느끼다 와플 초코 딸기 디바 맛있다 벨기에 맥주 어떠하다 기대 숙소 호스텔 예약 가다 하다 되다 이번 메다 하루 계산 보다 가다 싶다 나라 아이슬란드 리스본 스페인 겨울 어디 어디 가다 하다 촉박 시간 빠르다 가다 치다 박히다 하다 하다 암스테르담 프라하 여행 정리 쌓이다 되다 쌓다 말다"
"Blog_지름신_201701_1053","복사 본문 기타 기능 번역 보다 밀리다 일상 기록 부산 여행 이후 오랫만 묵다 사진 스타트 크다 신상 명동 매장 달려가다 재고 업다 사다 가을밤 도레 도레 찍다 기억 나다 한참 카츠 빠지다 녹다 넘다 맛있다 먹다 느끼 느끼 동다 바람 마니 로우 클래식 귀걸이 한눈 반하다 되다 사랑 먹다 먹다 질리다 생각 들르다 치마 워커 닥터 마틴 바르다 섹스어필 옅다 알다 바르다 보다 발색 반하다 지름신 이때 로우 클래식 시즌 사다 싶다 연희동 카페 래핑 폭스 타르트 꿀맛 연희동 길거리 어디 가다 들르다 한강 한강 보다 맥주 바람 쐬다 고민 사라지다 느낌 이제 춥다 다음 여기 가다 하다 여기 목적지 강남 도로시 호텔 가다 이쁘다 맛있다 분만 크다 리어 멀다 가다 좋다 지다 여기 가다 홍대 루프 리건스 스카이 라운지 피자 맛나다 흡입 합정 개화기 요정 여기 오다 문어 튀김 넘다 세다 입다 라이더 장만 라이더 이것 입다 아이폰 아이폰 나오다 처음 블랙 살다 이번 꺼다 무광 블랙 진리 찍다 두다 데일리 블랙 블랙 방문 모단 응접실 야무지다 클리어 완전 마지막 되다 할로윈 코스프레 보다 나름 재밌다 당하다 그렇다 나이 들다 하다 보다 하다 보다 홍대 발견 한제 인생 연어 유정상 방문 아방가르드 봉천 분위기 인테리어 하다 사람 많다 명동 스타일 나다 핑크 카페 루프 이쁘다 클로징 타임 가다 있다 좋다 가다 좋다 이태원 스치다 라운지 발걸음 이끌리다 분위기 취향 저격 가다 오다 한당 피맥 조합 밀리다 일상 기록"
"Blog_지름신_201701_1059","끄적거리다 일상 기록 대청소 복사 본문 기타 기능 번역 보다 대청소 겨울 창문 열다 노코 냉장고 냉장실 감자 먹다 맥주 냉장고 광파 오븐 굽다 파마 치즈 가루 갈릭 해물 크림 파스타 거트 샐러드 맛있다 맥주 이때 먹다 오늘 청소 낮잠 자다 청소 피클 담다 싶다 피곤 냉장고 맥주 넣다 두다 행복 하다 코스트코 가다 나서다 알다 식신 지름신 저리"
"Blog_지름신_201701_106","크리스마스 이브 객사 있다 카페 페르마타 가다 연말 시즌 커플 카페 담배 피다 나가다 가다 해명 하다 귀찮다 페르마타 야외 테라스 흡연 가능 좋다 지름신 내려오다 흔적 커피 맛있다 요요 사진 동영상 요요 사진 동영상 보다"
"Blog_지름신_201701_1065","안녕 오늘 예전 다녀오다 대만 후기 작성 보다 하다 그때 여행 적다 놓다 정보 날아가다 정보 도움 드리다 같다 적다 보다 하다 저희 갔다오다 타이베이 머무르다 가다 보다 여행 여알 저희 대만 가다 말다 하다 여름 대만 가다 버리다 진심 하다 더위 참다 없다 더위 우리 나라 비교 단호 캐리어 사다 여행 가다 없다 창고 구석 처박히다 있다 캐리어 꺼내다 들다 일교차 크다 보다 종류 챙기다 가다 일교차 덥다 덥다 덥다 컵라면 필수 다행 대만 음식 맞다 친구 먹다 특유 있다 대만 편의점 한국 컵라면 팔다 팔다 종류 없다 컵라면 챙기다 가다 태양 뜨겁다 썰다 크림 필수 대만 발달 있다 웬만하다 가다 사다 있다 여알 시간 이상 예매 아침 타다 가다 도착 시간 막차 타다 가다 노숙 결정 플랫폼 눕다 자다 있다 벤치 있다 하다 딱딱하다 청공 항내 시원하다 비행기 시간 남다 담요 챙기다 가다 보다 여권 사진 찍다 시간 기달리다 서다 비행기 탑승 제주 가다 타다 보다 해외 가다 와중 면세점 살다 자랑 여러분 이거 보다 생로 평소 사다 없다 터무니 없다 가격 면세 찬스 쓰다 진짜 싸다 사다 립스틱 로랑 틴트 수분 크림 베이스 정도 살다 같다 면세 때문 여행 가다 싶다 풍경 예쁘다 도착 숙소 캐리어 냅두다 떠나다 기내식 모잘르다 허기지다 근처 우육 맛집 개인 맛있다 국물 고기 찐하다 친구 한입 먹다 먹다 냄새 심하다 둔하다 친구 예민하다 형제 망고 빙수 먹다 보다 맛있다 최고 가격 먹다 한화 정도 하다 같다 최고 저희 패키지 하다 지하철 타다 다니다 용하다 외지 나가다 지하철 편하다 지하철 노선 엄청나다 단순 대만 친절 물다 보다 상세하다 대답 주다 저희 신기하다 돌아다니다 보다 쳐다보다 지하철 그것 기분 나쁘다 보다 눈빛 새롭다 보다 눈빛 지하철 찍다 보다 이거 한국 맛있다 이페이 본점 가다 웨이팅 거기 가다 합석 여부 물다 보다 합석 들다 가다 있다 저희 먹다 나오다 크다 원형 테이블 합석 들어가다 주방 뚫리다 있다 인기 많다 직원 힘들다 보이다 만두 공장 같다 큐브 스테이크 있다 솔트 기본 소금 추천 드리다 한국 팔다 가격 대만 차이 나다 대만 싸다 이국 느낌 지름신 들리다 사다 대만 싸다 좋다 저것 산거 정도 나중 가다 캐리어 담다 심각하다 여름 가다 말리다 가다 되다 미니 선풍기 가지다 가다 죽다 지름신 대다 대만 볼거리 고양이 강아지 하다 진짜 길거리 강아지 고양이 엄청나다 많다 무미 때문 발자국 가다 만지다 발자국 가다 만지다 일상 그렇다 사람 좋다 하다 마지막 대만 야경 사진 마무리 하다 즐겁다 일요일 되다 다음 재밌다 얘기 뵙다"
